abstract,analytical_method_development,article_name,assay_development,authors,center,center_pub,comments,created_at,data_analysis,data_generation,data_integration,data_standards,doi,issue,journal_name,other_link,pm_id,pmc_id,pp_pages,publication_id,resource_links,review,scopus_citations,show_at_home_order,signature_generation,software_development,updated_at,volume,year_published,n_citations,DCIC,Drug Toxicity,Proteomics,Microenvironment,HMS,Transcriptomics,NeuroLINCS
"BACKGROUND: Thousands of biological and biomedical investigators study of the functional role of single genes and their protein products in normal physiology and in disease. The findings from these studies are reported in research articles that stimulate new research. It is now established that a complex regulatory networks's is controlling human cellular fate, and this community of researchers are continually unraveling this network topology. Attempts to integrate results from such accumulated knowledge resulted in literature-based protein-protein interaction networks (PPINs) and pathway databases. These databases are widely used by the community to analyze new data collected from emerging genome-wide studies with the assumption that the data within these literature-based databases is the ground truth and contain no biases. While suspicion for research focus biases is growing, a concrete proof for it is still missing. It is difficult to prove because the real PPINs are mostly unknown. RESULTS: Here we analyzed the longitudinal discovery process of literature-based mammalian and yeast PPINs to observe that these networks are discovered non-uniformly. The pattern of discovery is related to a theoretical concept proposed by Kauffman called \expanding the adjacent possible\"". We introduce a network discovery model which explicitly includes the space of possibilities in the form of a true underlying PPIN. CONCLUSIONS: Our model strongly suggests that research focus biases exist in the observed discovery dynamics of these networks. In summary, more care should be placed when using PPIN databases for analysis of newly acquired data, and when considering prior knowledge when designing new experiments.""",1.0,Dynamics of the discovery process of protein-protein interactions from low content studies.,0.0,"Wang Z, Ma'ayan A, Clark NC",,1.0,,5/19/16 18:33,1.0,0.0,1.0,0.0,10.1186/s12918-015-0173-z,1,BMC Systems Biology,,26048415.0,PMC4456804,26,1,"{\Custom code\"":null}""",0.0,,,0.0,1.0,5/19/16 18:33,9,2015.0,6,1,0,0,0,0,0,0
"Drugs that inhibit RAF/MEK signaling, such as vemurafenib, elicit profound but often temporary anti-tumor responses in patients with BRAF(V) (600E) melanoma. Adaptive responses to RAF/MEK inhibition occur on a timescale of hours to days, involve homeostatic responses that reactivate MAP kinase signaling and compensatory mitogenic pathways, and attenuate the anti-tumor effects of RAF/MEK inhibitors. We profile adaptive responses across a panel of melanoma cell lines using multiplex biochemical measurement, single-cell assays, and statistical modeling and show that adaptation involves at least six signaling cascades that act to reduce drug potency (IC50) and maximal effect (i.e., Emax ≪ 1). Among these cascades, we identify a role for JNK/c-Jun signaling in vemurafenib adaptation and show that RAF and JNK inhibitors synergize in cell killing. This arises because JNK inhibition prevents a subset of cells in a cycling population from becoming quiescent upon vemurafenib treatment, thereby reducing drug Emax. Our findings demonstrate the breadth and diversity of adaptive responses to RAF/MEK inhibition and a means to identify which steps in a signaling cascade are most predictive of phenotypic response.",0.0,Systematic analysis of BRAFV600E melanomas reveals a role for JNK/c-Jun pathway in adaptive resistance to drug-induced apoptosis.,0.0,"Fallahi-Sichani M, Moerke NJ, Niepel M, Zhang T, Gray NS, Sorger PK",,1.0,,5/19/16 18:33,1.0,1.0,1.0,0.0,10.15252/msb.20145877,3,Molecular Systems Biology,,25814555.0,PMC4380931,797,3,"{\Publication Summary\"":\""http://lincs.hms.harvard.edu/fallahi-sichani-molsystbiol-2015/\"", \""Project Explorer\"":\""http://lincs.hms.harvard.edu/explore/adaptive-drug-resistance/\""}""",0.0,,,1.0,0.0,5/19/16 18:33,11,2015.0,18,0,0,0,1,1,0,0
"PhosphoSitePlus(®) (PSP, http://www.phosphosite.org/), a knowledgebase dedicated to mammalian post-translational modifications (PTMs), contains over 330,000 non-redundant PTMs, including phospho, acetyl, ubiquityl and methyl groups. Over 95% of the sites are from mass spectrometry (MS) experiments. In order to improve data reliability, early MS data have been reanalyzed, applying a common standard of analysis across over 1,000,000 spectra. Site assignments with P > 0.05 were filtered out. Two new downloads are available from PSP. The 'Regulatory sites' dataset includes curated information about modification sites that regulate downstream cellular processes, molecular functions and protein-protein interactions. The 'PTMVar' dataset, an intersect of missense mutations and PTMs from PSP, identifies over 25,000 PTMVars (PTMs Impacted by Variants) that can rewire signaling pathways. The PTMVar data include missense mutations from UniPROTKB, TCGA and other sources that cause over 2000 diseases or syndromes (MIM) and polymorphisms, or are associated with hundreds of cancers. PTMVars include 18 548 phosphorlyation sites, 3412 ubiquitylation sites, 2316 acetylation sites, 685 methylation sites and 245 succinylation sites.",0.0,"PhosphoSitePlus, 2014: mutations, PTMs and recalibrations.",0.0,"Hornbeck PV, Zhang B, Murray B, Kornhauser JM, Latham V, Skrzypek E",,1.0,,5/19/16 18:33,0.0,0.0,1.0,0.0,10.1093/nar/gku1267,Database issue,Nucleic Acids Research,,25514926.0,PMC4383998,D512-20,5,"{\PhosphoSitePlus\"":\""http://www.phosphosite.org/\""}""",0.0,,,0.0,1.0,5/19/16 18:33,43,2015.0,291,0,0,0,0,0,0,0
"With advances in genomics, transcriptomics, metabolomics and proteomics, and more expansive electronic clinical record monitoring, as well as advances in computation, we have entered the Big Data era in biomedical research. Data gathering is growing rapidly while only a small fraction of this data is converted to useful knowledge or reused in future studies. To improve this, an important concept that is often overlooked is data abstraction. To fuse and reuse biomedical datasets from diverse resources, data abstraction is frequently required. Here we summarize some of the major Big Data biomedical research resources for genomics, proteomics and phenotype data, collected from mammalian cells, tissues and organisms. We then suggest simple data abstraction methods for fusing this diverse but related data. Finally, we demonstrate examples of the potential utility of such data integration efforts, while warning about the inherit biases that exist within such data.",0.0,"Abstraction for data integration: Fusing mammalian molecular, cellular and phenotype big datasets for better knowledge extraction.",0.0,"Wang Z, Rouillard AD, Ma’ayan A",,1.0,,5/19/16 18:33,1.0,0.0,1.0,0.0,,,Computational Biology and Chemistry,,26101093.0,PMC4675694,123-38,45,,1.0,,,0.0,0.0,5/19/16 18:33,59 Pt B,2015.0,0,0,0,0,0,0,0,0
"Single-cell analysis reveals aspects of cellular physiology not evident from population-based studies, particularly in the case of highly multiplexed methods such as mass cytometry (CyTOF) able to correlate the levels of multiple signalling, differentiation and cell fate markers. Immunofluorescence (IF) microscopy adds information on cell morphology and the microenvironment that are not obtained using flow-based techniques, but the multiplicity of conventional IF is limited. This has motivated development of imaging methods that require specialized instrumentation, exotic reagents or proprietary protocols that are difficult to reproduce in most laboratories. Here we report a public-domain method for achieving high multiplicity single-cell IF using cyclic immunofluorescence (CycIF), a simple and versatile procedure in which four-colour staining alternates with chemical inactivation of fluorophores to progressively build a multichannel image. Because CycIF uses standard reagents and instrumentation and is no more expensive than conventional IF, it is suitable for high-throughput assays and screening applications.",0.0,Highly multiplexed imaging of single cells using a high-throughput cyclic immunofluorescence method.,1.0,"Fallahi-Sichani M, Sorger PK, Lin JR",,1.0,,5/19/16 18:33,1.0,1.0,0.0,0.0,10.1038/ncomms9390,,Nature Communications,,26399630.0,PMC4587398,8390,46,"{\Publication Summary\"":\""http://lincs.hms.harvard.edu/lin-natcommun-2015/\"", \""Project Explorer\"":\""http://lincs.hms.harvard.edu/lin-natcommun-2015-resource/\"", \""ImageJ Macros/MATLAB Scripts\"":\""http://lincs.hms.harvard.edu/lin-natcommun-2015-resource/\""}""",0.0,,,1.0,0.0,5/19/16 18:33,6,2015.0,29,0,0,0,0,1,0,0
"Gene set analysis of differential expression, which identifies collectively differentially expressed gene sets, has become an important tool for biology. The power of this approach lies in its reduction of the dimensionality of the statistical problem and its incorporation of biological interpretation by construction. Many approaches to gene set analysis have been proposed, but benchmarking their performance in the setting of real biological data is difficult due to the lack of a gold standard. In a previously published work we proposed a geometrical approach to differential expression which performed highly in benchmarking tests and compared well to the most popular methods of differential gene expression. As reported, this approach has a natural extension to gene set analysis which we call Principal Angle Enrichment Analysis (PAEA). PAEA employs dimensionality reduction and a multivariate approach for gene set enrichment analysis. However, the performance of this method has not been assessed nor its implementation as a web-based tool. Here we describe new benchmarking protocols for gene set analysis methods and find that PAEA performs highly. The PAEA method is implemented as a user-friendly web-based tool, which contains 70 gene set libraries and is freely available to the community.",1.0,Principal Angle Enrichment Analysis (PAEA): Dimensionally reduced multivariate gene set enrichment analysis tool.,0.0,"Wang Z, Monteiro CD, Jones MR, Clark NR, Ma’ayan A, Szymkiewicz M",,1.0,,5/19/16 18:33,1.0,0.0,1.0,0.0,,,Proceedings (IEEE Int Conf Bioinformatics Biomed),,26848405.0,PMC4737646,256-262,47,"{\Principal Angle Enrichment Analysis (PAEA)\"":\""http://amp.pharm.mssm.edu/PAEA/\""}""",0.0,,,0.0,1.0,5/19/16 18:33,2015,2015.0,6,0,0,0,0,0,0,0
"Inhibition of cancer-promoting kinases is an established therapeutic strategy for the treatment of many cancers, although resistance to kinase inhibitors is common. One way to overcome resistance is to target orthogonal cancer-promoting pathways. Bromo and Extra-Terminal (BET) domain proteins, which belong to the family of epigenetic readers, have recently emerged as promising therapeutic targets in multiple cancers. The development of multitarget drugs that inhibit kinase and BET proteins therefore may be a promising strategy to overcome tumor resistance and prolong therapeutic efficacy in the clinic. We developed a general computational screening approach to identify novel dual kinase/bromodomain inhibitors from millions of commercially available small molecules. Our method integrated machine learning using big datasets of kinase inhibitors and structure-based drug design. Here we describe the computational methodology, including validation and characterization of our models and their application and integration into a scalable virtual screening pipeline. We screened over 6 million commercially available compounds and selected 24 for testing in BRD4 and EGFR biochemical assays. We identified several novel BRD4 inhibitors, among them a first in class dual EGFR-BRD4 inhibitor. Our studies suggest that this computational screening approach may be broadly applicable for identifying dual kinase/BET inhibitors with potential for treating various cancers.",0.0,Large-scale computational screening identifies first in class multitarget inhibitor of EGFR kinase and BRD4.,0.0,"Schürer SC, Allen BK, Mehta S, Ember SW, Schonbrunn E, Ayad N",,1.0,,5/19/16 18:33,1.0,0.0,1.0,0.0,,,Scientific Reports,,26596901.0,PMC4657038,16924,48,,0.0,,,0.0,0.0,5/19/16 18:33,5,2015.0,7,0,0,0,0,0,0,0
"When cells are exposed to death ligands such as TRAIL, a fraction undergoes apoptosis and a fraction survives; if surviving cells are re-exposed to TRAIL, fractional killing is once again observed. Therapeutic antibodies directed against TRAIL receptors also cause fractional killing, even at saturating concentrations, limiting their effectiveness. Fractional killing arises from cell-to-cell fluctuations in protein levels (extrinsic noise), but how this results in a clean bifurcation between life and death remains unclear. In this paper, we identify a threshold in the rate and timing of initiator caspase activation that distinguishes cells that live from those that die; by mapping this threshold, we can predict fractional killing of cells exposed to natural and synthetic agonists alone or in combination with sensitizing drugs such as bortezomib. A phenomenological model of the threshold also quantifies the contributions of two resistance genes (c-FLIP and Bcl-2), providing new insight into the control of cell fate by opposing pro-death and pro-survival proteins and suggesting new criteria for evaluating the efficacy of therapeutic TRAIL receptor agonists.",0.0,Fractional killing arises from cell-to-cell variability in overcoming a caspase activity threshold.,0.0,"Sorger PK, Hafner M, Roux J, Bandara S, Sims JJ, Hudson H, Chai D",,1.0,,5/19/16 18:33,1.0,1.0,1.0,0.0,10.15252/msb.20145584,5,Molecular Systems Biology,,25953765.0,PMC4461398,803,56,"{\Publication Summary\"":\""http://lincs.hms.harvard.edu/roux-molsystbiol-2015/\"", \""Project Explorer\"":\""http://lincs.hms.harvard.edu/explore/trail-threshold-variability/\"", \""MATLAB Scripts\"":\""http://lincs.hms.harvard.edu/explore/trail-threshold-variability/\""}""",0.0,,,1.0,0.0,5/19/16 18:33,11,2015.0,18,0,0,0,0,1,0,0
"Unbiased discovery approaches have the potential to uncover neurobiological insights into CNS disease and lead to the development of therapies. Here, we review lessons learned from imaging-based screening approaches and recent advances in these areas, including powerful new computational tools to synthesize complex data into more useful knowledge that can reliably guide future research and development.",0.0,Cell-based screening: extracting meaning from complex data.,0.0,"Finkbeiner S, Frumkin M, Kassner PD",,1.0,,11/3/16 16:33,0.0,0.0,0.0,0.0,10.1016/j.neuron.2015.02.023,1,Neuron,,25856492.0,PMC445744,160-74,100,,1.0,,,0.0,0.0,,86,2015.0,0,0,0,0,0,0,0,1
"Spinal muscular atrophy (SMA) is an inherited neuromuscular disease primarily characterized by degeneration of spinal motor neurons, and caused by reduced levels of the SMN protein. Previous studies to understand the proteomic consequences of reduced SMN have mostly utilized patient fibroblasts and animal models. We have derived human motor neurons from type I SMA and healthy controls by creating their induced pluripotent stem cells (iPSCs). Quantitative mass spectrometry of these cells revealed increased expression of 63 proteins in control motor neurons compared to respective fibroblasts, whereas 30 proteins were increased in SMA motor neurons vs. their fibroblasts. Notably, UBA1 was significantly decreased in SMA motor neurons, supporting evidence for ubiquitin pathway defects. Subcellular distribution of UBA1 was predominantly cytoplasmic in SMA motor neurons in contrast to nuclear in control motor neurons; suggestive of neurodevelopmental abnormalities. Many of the proteins that were decreased in SMA motor neurons, including beta III-tubulin and UCHL1, were associated with neurodevelopment and differentiation. These neuron-specific consequences of SMN depletion were not evident in fibroblasts, highlighting the importance of iPSC technology. The proteomic profiles identified here provide a useful resource to explore the molecular consequences of reduced SMN in motor neurons, and for the identification of novel biomarker and therapeutic targets for SMA.",0.0,Spinal muscular atrophy patient iPSC-derived motor neurons have reduced expression of proteins important in neuronal development.,0.0,"Mandefro B, Sareen D, Fuller HR, Shirran SL, Gross AR, Kaus AS, Botting CH, Morris GE",,1.0,,5/19/16 18:33,1.0,1.0,0.0,0.0,,,Frontiers in Cellular Neuroscience,,26793058.0,PMC4707261,506,51,,0.0,,,0.0,0.0,5/19/16 18:33,9,2016.0,10,0,0,0,0,0,0,0
"Profiling posttranslational modifications represents an alternative dimension to gene expression data in characterizing cellular processes. Many cellular responses to drugs are mediated by changes in cellular phosphosignaling. We sought to develop a common platform on which phosphosignaling responses could be profiled across thousands of samples, and created a targeted MS assay that profiles a reduced-representation set of phosphopeptides that we show to be strong indicators of responses to chemical perturbagens. To develop the assay, we investigated the coordinate regulation of phosphosites in samples derived from three cell lines treated with 26 different bioactive small molecules. Phosphopeptide analytes were selected from these discovery studies by clustering and picking 1 to 2 proxy members from each cluster. A quantitative, targeted PRM assay was developed to directly measure 96 reduced-representation probes. Sample processing for proteolytic digestion, protein quantification, peptide desalting, and phosphopeptide enrichment have been fully automated, making possible the simultaneous processing of 96 samples in only 3 days, with a plate phosphopeptide enrichment variance of 12%. This highly reproducible process allowed ~95% of the reduced-representation phosphopeptide probes to be detected in ~200 samples. The performance of the assay was evaluated by measuring the probes in new samples generated under treatment conditions from discovery experiments, recapitulating the observations of deeper experiments using a fraction of the analytical effort. We measured these probes in new experiments varying the treatments, cell types, and timepoints to demonstrate generalizability. We demonstrated that the assay is sensitive to disruptions in common signaling pathways (e.g. MAPK, PI3K/mTOR, and CDK). The high-throughput, reduced-representation phosphoproteomics assay provides a platform for the comparison of perturbations across a range of biological conditions, suitable for profiling thousands of samples. We believe the assay will prove highly useful for classification of known and novel drug and genetic mechanisms through comparison of phosphoproteomic signatures.",0.0,Reduced-representation phosphosignatures measured by quantitative targeted MS capture cellular states and enable large-scale comparison of drug-induced phenotypes.,1.0,"Jaffe JD, Lu X, Carr SA, Subramanian A, Li J, Abelin JG, Patel J, Feeney CM, Fagbami L, Creech AL, Hu R, Lam D, Davison D, Pino L, Qiao JW, Kuhn E, Officer A, Abbatiello S, Sidman R, Snyder E",,1.0,,5/19/16 18:33,1.0,1.0,0.0,0.0,10.1074/mcp.M116.058354,5,Molecular and Cellular Proteomics,,26912667.0,PMC4858944,1622-41,52,"{\LINCS PCCSE Panorama Repository\"":\""https://panoramaweb.org/labkey/LINCS.url\""}""",0.0,,,0.0,0.0,5/19/16 18:33,15,2016.0,17,0,0,1,0,0,0,0
"MOTIVATION: Adverse Drug Reactions (ADRs) are a central consideration during drug development. Here we present a machine learning classifier to prioritize ADRs for approved drugs and pre-clinical small-molecule compounds by combining chemical structure (CS) and gene expression (GE) features. The GE data is from the Library of Integrated Network-based Cellular Signatures (LINCS) L1000 dataset that measured changes in GE before and after treatment of human cells with over 20,000 small molecule compounds including most of the FDA-approved drugs. Using various ben-chmarking methods, we show that the integration of GE data with the CS of the drugs can significantly improve the predictability of ADRs. Moreover, transforming GE features to enrichment vectors of biological terms further improves the predictive capability of the classifiers. The most predictive biological-term features can assist in understanding the drug mechanisms of action. Finally, we applied the classifier to all >20,000 small molecules profiled, and developed a web portal for browsing and searching predictive small-molecule/ADR connections.",1.0,Drug induced adverse events prediction with the LINCS L1000 data.,0.0,"Wang Z, Ma'ayan A, Clark NC",,1.0,,5/19/16 18:33,1.0,0.0,1.0,0.0,10.1093/bioinformatics/btw168,15,Bioinformatics,,27153606.0,PMC4965635,2338-45,53,"{\SEP-L1000\"":\""http://maayanlab.net/SEP-L1000/\"", \""Video\"":\""https://www.youtube.com/watch?v=EHUAU05O0kQ\""}""",0.0,,,0.0,1.0,5/19/16 18:33,32,2016.0,10,1,0,0,0,0,0,0
"Reproducibility is vital in science. For complex computational methods, it is often necessary, not just to recreate the code, but also the software and hardware environment to reproduce results. Virtual machines, and container software such as Docker, make it possible to reproduce the exact environment regardless of the underlying hardware and operating system. However, workflows that use Graphical User Interfaces (GUIs) remain difficult to replicate on different host systems as there is no high level graphical software layer common to all platforms. GUIdock allows for the facile distribution of a systems biology application along with its graphics environment. Complex graphics based workflows, ubiquitous in systems biology, can now be easily exported and reproduced on many different platforms. GUIdock uses Docker, an open source project that provides a container with only the absolutely necessary software dependencies and configures a common X Windows (X11) graphic interface on Linux, Macintosh and Windows platforms. As proof of concept, we present a Docker package that contains a Bioconductor application written in R and C++ called networkBMA for gene network inference. Our package also includes Cytoscape, a java-based platform with a graphical user interface for visualizing and analyzing gene networks, and the CyNetworkBMA app, a Cytoscape app that allows the use of networkBMA via the user-friendly Cytoscape interface.",0.0,GUIdock: Using Docker containers with a common graphics user interface to address the reproducibility of research.,0.0,"Hung LH, Kristiyanto D, Lee SB, Yeung KY",,1.0,,5/19/16 18:33,0.0,0.0,0.0,0.0,10.1371/journal.pone.0152686,4,PLoS ONE,,27045593.0,PMC4821530,e0152686,54,,0.0,,,0.0,1.0,5/19/16 18:33,11,2016.0,6,0,0,0,0,0,0,0
"Enrichment analysis is a popular method for analyzing gene sets generated by genome-wide experiments. Here we present a significant update to one of the tools in this domain called Enrichr. Enrichr currently contains a large collection of diverse gene set libraries available for analysis and download. In total, Enrichr currently contains 180 184 annotated gene sets from 102 gene set libraries. New features have been added to Enrichr including the ability to submit fuzzy sets, upload BED files, improved application programming interface and visualization of the results as clustergrams. Overall, Enrichr is a comprehensive resource for curated gene sets and a search engine that accumulates biological knowledge for further biological discoveries. Enrichr is freely available at: http://amp.pharm.mssm.edu/Enrichr.",1.0,Enrichr: a comprehensive gene set enrichment analysis web server 2016 update.,0.0,"Wang Z, Ma'ayan A, Gundersen GW, Monteiro CD, Rouillard AD, Jones MR, Duan Q, Fernandez NF, Kuleshov MV, Koplev S, Jenkins SL, Jagodnik KM, Lachmann A, McDermott MG",,1.0,,6/1/16 23:13,1.0,0.0,1.0,0.0,10.1093/nar/gkw377,W1,Nucleic Acids Research,,27141961.0,PMC4987924,W90-7,58,"{\Enrichr\"": \""http://amp.pharm.mssm.edu/Enrichr\""}""",0.0,,,0.0,1.0,,44,2016.0,239,1,0,0,0,0,0,0
"Drug sensitivity and resistance are conventionally quantified by IC50 or Emax values, but these metrics are highly sensitive to the number of divisions taking place over the course of a response assay. The dependency of IC50 and Emax on division rate creates artefactual correlations between genotype and drug sensitivity, while obscuring valuable biological insights and interfering with biomarker discovery. We derive alternative small molecule drug-response metrics that are insensitive to division number. These are based on estimation of the magnitude of drug-induced growth rate inhibition (GR) using endpoint or time-course assays. We show that GR50 and GRmax are superior to conventional metrics for assessing the effects of small molecule drugs in dividing cells. Moreover, adopting GR metrics requires only modest changes in experimental protocols. We expect GR metrics to improve the study of cell signaling and growth using small molecules and biologics and to facilitate the discovery of drug-response biomarkers and the identification of drugs effective against specific patient-derived tumor cells.",1.0,Growth rate inhibition metrics correct for confounders in measuring sensitivity to cancer drugs.,1.0,"Niepel M, Sorger PK, Hafner M, Chung M",,1.0,,6/1/16 23:13,1.0,1.0,0.0,0.0,10.1038/nmeth.3853,6,Nature Methods,,27135972.0,PMC4887336,521-7,59,"{\Publication Summary\"": \""http://lincs.hms.harvard.edu/hafner-natmethods-2016/\"", \""GR Browser\"": \""http://grcalculator.org/\"", \""MATLAB/Python Scripts\"": \""https://github.com/sorgerlab/gr50_tools/\""}""",0.0,,,0.0,1.0,,13,2016.0,38,0,0,0,0,1,0,0
