abstract,analytical_method_development,article_name,assay_development,authors,center,center_pub,comments,created_at,data_analysis,data_generation,data_integration,data_standards,doi,issue,journal_name,other_link,pm_id,pmc_id,pp_pages,publication_id,resource_links,review,scopus_citations,show_at_home_order,signature_generation,software_development,updated_at,volume,year_published,PMCID,citations,n_citations,citation_years,DCIC,Drug Toxicity,Proteomics,Microenvironment,HMS,Transcriptomics,NeuroLINCS
"Whereas genomic data are universally machine-readable, data from imaging, multiplex biochemistry, flow cytometry and other cell- and tissue-based assays usually reside in loosely organized files of poorly documented provenance. This arises because the relational databases used in genomic research are difficult to adapt to rapidly evolving experimental designs, data formats and analytic algorithms. Here we describe an adaptive approach to managing experimental data based on semantically typed data hypercubes (SDCubes) that combine hierarchical data format 5 (HDF5) and extensible markup language (XML) file types. We demonstrate the application of SDCube-based storage using ImageRail, a software package for high-throughput microscopy. Experimental design and its day-to-day evolution, not rigid standards, determine how ImageRail data are organized in SDCubes. We applied ImageRail to collect and analyze drug dose-response landscapes in human cell lines at single-cell resolution.",0.0,Adaptive informatics for multifactorial and high-content biological data.,0.0,"Niepel M, Sorger PK, Muhlich JL, Millard BL, Menden MP",,1.0,,5/19/16 18:33,1.0,1.0,0.0,1.0,10.1038/nmeth.1600,6,Nature Methods,,21516115.0,PMC3105758,487-93,43.0,"{\SDCubes\"":\""https://github.com/sorgerlab/SDCube_API\""}""",0.0,,,0.0,1.0,5/19/16 18:33,8,2011.0,PMC3105758,"['4133729', '4148203', '3673213', '3270411', '3270111', '4914393', '3832711', '3187564', '5372219', '3322972', '4165886', '4296150', '3783040', '3438894', '5127489', '3760004', '3845839', '3947796', '4949266', '4174537', '4818567', '3564696', '3523717', '3465074', '5148592']",25.0,"[2014, 2014, 2013, 0, 2011, 2016, 2013, 2011, 2016, 2012, 2014, 2014, 2013, 2012, 2016, 2013, 2013, 2013, 2016, 2012, 2015, 2013, 2012, 2012, 2016]",0,0,0,0,1,0,0
"Computational analyses of systematic measurements on the states and activities of signaling proteins (as captured by phosphoproteomic data, for example) have the potential to uncover uncharacterized protein-protein interactions and to identify the subset that are important for cellular response to specific biological stimuli. However, inferring mechanistically plausible protein signaling networks (PSNs) from phosphoproteomics data is a difficult task, owing in part to the lack of sufficiently comprehensive experimental measurements, the inherent limitations of network inference algorithms, and a lack of standards for assessing the accuracy of inferred PSNs. A case study in which 12 research groups inferred PSNs from a phosphoproteomics data set demonstrates an assessment of inferred PSNs on the basis of the accuracy of their predictions. The concurrent prediction of the same previously unreported signaling interactions by different participating teams suggests relevant validation experiments and establishes a framework for combining PSNs inferred by multiple research groups into a composite PSN. We conclude that crowdsourcing the construction of PSNs-that is, outsourcing the task to the interested community-may be an effective strategy for network inference.",0.0,Crowdsourcing network inference: the dream predictive signaling network challenge.,0.0,"Sorger PK, Saez-Rodriguez J, Prill RJ, Alexopoulos LG, Stolovitzky G",,1.0,,5/19/16 18:33,0.0,0.0,0.0,0.0,10.1126/scisignal.2002212,189,Science Signaling,,21900204.0,PMC3465072,mr7,44.0,,1.0,,,0.0,0.0,5/19/16 18:33,4,2011.0,PMC3465072,"['3649990', '4611647', '4872295', '4559359', '4945826', '3503555', '5869720', '4015903', '3338013', '5319798', '4318527', '3927870', '5075921', '4514931', '4944831', '3605281', '3777925', '4919846', '5026418', '4485132', '3720774', '3897241', '4664553', '4854847', '5545976', '4447414', '3360688', '3987808', '4070074', '3647006', '3436796', '3972682', '4503556', '4803391', '4133630', '4837986', '4350443', '3716858', '5632288', '4816347', '3529704', '3377689', '3868523', '5860161', '5351548', '4817425', '4013075']",47.0,"[2013, 2015, 2016, 2015, 2015, 2012, 2018, 2013, 2012, 2017, 2014, 2014, 2016, 2015, 2016, 2012, 2013, 2016, 2016, 2015, 2013, 0, 2015, 2016, 2017, 2015, 2012, 2013, 0, 2013, 2012, 2013, 2015, 2015, 2014, 2016, 2015, 2013, 2017, 2016, 2012, 2012, 2013, 2017, 2016, 2015, 2014]",0,0,0,0,1,0,0
"High-content cellomic analysis is a powerful tool for rapid screening of cellular responses to extracellular cues and examination of intracellular signal transduction pathways at the single-cell level. In conjunction with microfluidics technology that provides unique advantages in sample processing and precise control of fluid delivery, it holds great potential to transform lab-on-a-chip systems for high-throughput cellular analysis. However, high-content imaging instruments are expensive, sophisticated, and not readily accessible. Herein, we report on a laser scanning cytometry approach that exploits a bench-top microarray scanner as an end-point reader to perform rapid and automated fluorescence imaging of cells cultured on a chip. Using high-content imaging analysis algorithms, we demonstrated multiplexed measurements of morphometric and proteomic parameters from all single cells. Our approach shows the improvement of both sensitivity and dynamic range by two orders of magnitude as compared to conventional epifluorescence microscopy. We applied this technology to high-throughput analysis of mesenchymal stem cells on an extracellular matrix protein array and characterization of heterotypic cell populations. This work demonstrates the feasibility of a laser microarray scanner for high-content cellomic analysis and opens up new opportunities to conduct informative cellular analysis and cell-based screening in the lab-on-a-chip systems.",0.0,High-content single cell analysis on chip using a laser microarray scanner.,0.0,"Wu Y, Fan R, Zhou J, Lee SK",,1.0,,5/19/16 18:33,1.0,0.0,0.0,0.0,10.1039/c2lc40309a,23,Lab on a Chip,,22991099.0,,5025-33,42.0,,0.0,,,0.0,0.0,5/19/16 18:33,12,2012.0,,,,,0,0,0,0,0,0,0
"Clinical responses to anticancer therapies are often restricted to a subset of patients. In some cases, mutated cancer genes are potent biomarkers for responses to targeted agents. Here, to uncover new biomarkers of sensitivity and resistance to cancer therapeutics, we screened a panel of several hundred cancer cell lines--which represent much of the tissue-type and genetic diversity of human cancers--with 130 drugs under clinical and preclinical investigation. In aggregate, we found that mutated cancer genes were associated with cellular response to most currently available cancer drugs. Classic oncogene addiction paradigms were modified by additional tissue-specific or expression biomarkers, and some frequently mutated genes were associated with sensitivity to a broad range of therapeutic agents. Unexpected relationships were revealed, including the marked sensitivity of Ewing's sarcoma cells harbouring the EWS (also known as EWSR1)-FLI1 gene translocation to poly(ADP-ribose) polymerase (PARP) inhibitors. By linking drug activity to the functional complexity of cancer genomes, systematic pharmacogenomic profiling in cancer cell lines provides a powerful biomarker discovery platform to guide rational cancer therapeutic strategies.",0.0,Systematic identification of genomic markers of drug sensitivity in cancer cells.,0.0,"Zhang T, Gray NS, Benes CH, Liu Q, Hur W, Garnett MJ, Edelman EJ, Heidorn SJ, Greenman CD, Dastur A, Lau KW, Greninger P, Thompson IR, Luo X, Soares J, Iorio F, Surdez D, Chen L, Milano RJ, Bignell GR, Tam AT, Davies H, Stevenson JA, Barthorpe S, Lutz SR, Kogera F, Lawrence K, McLaren-Douglas A, Mitropoulos X, Mironenko T, Thi H, Richardson L, Zhou W, Jewitt F, O'Brien P, Boisvert JL, Price S, Yang W, Deng X, Butler A, Choi HG, Chang JW, Baselga J, Stamenkovic I, Engelman JA, Sharma SV, Delattre O, Saez-Rodriguez J, Settleman J, Futreal PA, Haber DA, Stratton MR, Ramaswamy S, McDermott U",,1.0,,5/19/16 18:33,1.0,1.0,1.0,0.0,10.1038/nature11005,7391,Nature,,22460902.0,PMC3349233,570-5,38.0,,0.0,,,1.0,0.0,5/19/16 18:33,483,2012.0,PMC3349233,"['4360670', '3514662', '4187119', '5150652', '4850131', '5270455', '4818738', '4861905', '5833933', '5192966', '4792584', '4489368', '4756277', '3966786', '4476092', '4056435', '5538315', '5204182', '6089937', '5510182', '5341617', '3543849', '5310278', '4552408', '5876130', '4160413', '6014687', '5558053', '4281276', '4633700', '5768336', '3531057', '4147917', '6018991', '5575612', '5040751', '5722542', '4080742', '3618473', '4540199', '5321471', '5114336', '4003351', '4703841', '4669703', '3916084', '5514935', '4573368', '3651412', '4147926', '3783590', '4436355', '4808018', '5421879', '4399757', '6066791', '5680301', '4029965', '4404582', '5639711', '4351621', '4527963', '4833434', '3911888', '4943760', '4410013', '3766379', '3874239', '5593682', '4887341', '3845839', '3941151', '4792701', '5161614', '3583194', '3515204', '4610238', '5130158', '5343844', '5065123', '4538440', '4007225', '3971504', '4213513', '5862606', '3431500', '3842963', '4474541', '4538616', '5930111', '3531186', '5815509', '3575368', '4374701', '5541434', '4785360', '4243102', '5454719', '5581701', '4354107', '3706745', '5053689', '3460918', '4359490', '4774108', '5582997', '5291837', '5180091', '4719067', '4371986', '3923229', '5024153', '3823187', '4589737', '4836290', '4036469', '3463227', '4070589', '5752671', '4318264', '6087449', '3413665', '4634360', '4367595', '3595698', '3954635', '3467249', '5680312', '4308741', '5502825', '5031330', '5784992', '5554950', '4891001', '5774229', '5554885', '3973898', '4177365', '5920436', '4141655', '4518023', '3429351', '5805407', '4834280', '4237165', '5645262', '4381406', '6000284', '3873899', '4046322', '4785723', '5554409', '4615258', '4755199', '6065407', '4071408', '4407699', '4343013', '5971110', '5628644', '4718766', '4496244', '4214597', '5146827', '5266396', '3600490', '4229627', '4167990', '5008349', '5410089', '3947796', '4826949', '5708307', '4460709', '5805807', '4549564', '5990478', '4355226', '5760202', '4064311', '5771884', '5762512', '5508131', '4501645', '4532321', '4474763', '3632661', '4748564', '4587957', '4201473', '5422801', '5334473', '6064051', '3898721', '5458737', '4186247', '4643634', '4854847', '4747823', '3672971', '4083755', '5279869', '4091782', '4631646', '4059819', '3509128', '5817111', '5030729', '4702816', '5510643', '4054092', '3807645', '5118939', '3899349', '5820685', '4046135', '5896245', '4325131', '5241177', '5528750', '5240730', '3823715', '5740648', '4485860', '3995541', '3937815', '5528621', '4611740', '4380931', '4748276', '4354610', '4053087', '5813001', '5013662', '4704493', '5753377', '5746077', '5161635', '4852434', '4671548', '4197299', '4689161', '3604032', '4990332', '3496163', '5356455', '3618426', '6045584', '5217344', '4026179', '4675694', '5683351', '5731348', '5657393', '4994023', '4299910', '5094973', '4122288', '4700448', '5531859', '5224525', '4587665', '4023809', '5107984', '5629618', '4106990', '4653387', '4119520', '5056437', '5793836', '5379071', '4322529', '4913322', '5992609', '4296225', '4170218', '5501076', '4944194', '4760294', '3937590', '3443151', '4079649', '4662461', '4718762', '5461547', '3721163', '3722529', '3717945', '3667614', '5123617', '3700760', '5870540', '3529069', '3650991', '5352074', '4476933', '5351410', '5743227', '3926026', '5750219', '4819782', '4144039', '5598297', '5992159', '5662094', '4232548', '5528555', '3950186', '3588144', '5935540', '4368776', '5928049', '3738466', '5693607', '4891048', '4036381', '3951056', '5312719', '4782372', '4238051', '3678719', '5601710', '3868440', '4480971', '5020469', '4330752', '4237931', '6070504', '4364868', '5451241', '4082167', '4547623', '4862054', '5749541', '3566071', '4094402', '3890948', '4681992', '4565389', '3672953', '3929689', '5860077', '6022535', '5896091', '4850087', '4287932', '5857178', '4429698', '5860498', '5731344', '5473890', '4022462', '4357281', '3919969', '5009528', '6059019', '5536177', '5126759', '3598783', '5801688', '4599732', '4786220', '5341104', '3691946', '5689598', '5037319', '4682411', '3595349', '5935461', '4636476', '4386669', '3595397', '5973065', '4939880', '3963513', '5470969', '5310525', '6061940', '5995257', '4945830', '5652780', '4967469', '5442428', '3823674', '5981615', '4593363', '5955018', '4413026', '4179751', '4176343', '5874718', '4355234', '5717260', '3964944', '4468607', '5669847', '4770715', '5549706', '5295379', '5354928', '5340226', '4434991', '4423219', '4847433', '4033189', '3480879', '4768263', '4030016', '5418080', '4919108', '5216791', '3985076', '4155001', '4483896', '5239501', '3564987', '5538298', '4668932', '5396071', '3902936', '5225290', '4818107', '4930834', '5710001', '4102467', '3753578', '4128487', '4457588', '5773178', '6088408', '5140783', '5774632', '4884928', '4604168', '4460673', '4059766', '4230717', '5748209', '4968631', '3804878', '3876254', '5538335', '4887336', '4518499', '4076632', '5457702', '5445660', '5577248', '3479457', '5476590', '6015045', '5582957', '5120272', '5178998', '4560800', '5461962', '4965733', '5866042', '4675831', '3602343', '4135446', '4029366', '4282979', '4055551', '5411799', '5397135', '4201331', '3712892', '4867560', '4499117', '5827944', '3961306', '4112013', '5763295', '4688377', '5117779', '5786822', '4991425', '5655668', '3939353', '4007508', '5634876', '5540806', '4258049', '6073167', '3736308', '3531829', '4470683', '4234128', '4651038', '5375735', '4740793', '4480710', '5255052', '4116514', '5931092', '3988805', '3569633', '4396063', '3946062', '5012434', '4167545', '5864202', '4358808', '5583477', '4297247', '5220136', '6031019', '5457712', '5538845', '5028846', '3656451', '3442291', '3808235', '4587544', '3973435', '5580432', '4154497', '4671159', '4385398', '3674398', '5630037', '4303136', '5038975', '4563730', '4768389', '4239647', '5445594', '4904895', '4188526', '4261930', '4244910', '3860348', '5995938', '5072366', '4161369', '5342590', '4722663', '5312273', '3913033', '4591242', '6052082', '4683444', '5623120', '4360667', '3660556', '5034284', '6056044', '3609407', '4949322', '4208810', '4728196', '3971475', '4995628', '4775079', '3549721', '5658677', '4537214', '4157793', '4558215', '5235371', '4898971', '3812366', '4084973', '5053674', '5625556', '4910870', '5463424', '5996063', '5622049', '4100887', '5356876', '3567922', '5032827', '5436135', '4446296', '5352203', '5915140', '5508574', '6022689', '3658274', '3989421', '3674280', '4518867', '4751258', '5537700', '3990471', '4551903', '4103868', '5084460', '5367762', '4621756', '4207861', '5007751', '5986246', '5355231', '5683396', '4439870', '4541646', '4313848', '4742834', '4926729', '5771805', '3681490', '4624427', '5905335', '4153537', '3561056', '5821274', '3660127', '5801888', '3893930', '4675899', '4829493', '6031047', '6025969', '5662764', '4467424', '4278592', '4375054', '5977747', '3640019', '4665164', '5123312', '4573460', '4047912', '5886578', '5777758', '5846483', '4749542', '4456187', '5951888', '5551024', '4802229', '4058417', '4279440', '6084606', '6028652', '6021419', '4987219', '4506246', '5579334', '4893961', '3572006', '4704494', '3523228', '4426229', '4251289', '4358765', '5058786', '5029630', '4480703', '4406016', '3905727', '3567478']",655.0,"[2015, 0, 2014, 2016, 0, 2014, 2015, 2016, 2017, 2016, 2015, 2015, 2016, 2014, 2015, 2013, 2017, 2016, 2018, 2017, 2017, 2012, 2017, 2015, 2018, 2014, 2016, 2017, 2014, 0, 2017, 2012, 2014, 2016, 2017, 2016, 2017, 2014, 2013, 2014, 2017, 2016, 0, 2015, 2015, 2014, 2017, 2015, 2013, 2014, 2013, 2015, 2015, 2017, 2015, 0, 2017, 2014, 2015, 0, 2015, 2015, 2016, 0, 2016, 2015, 0, 2013, 2017, 2016, 2013, 2013, 2016, 2016, 2012, 2012, 0, 0, 2017, 2016, 2015, 2014, 2014, 2014, 2018, 2012, 2013, 2015, 2015, 2018, 2012, 2017, 2013, 2015, 2017, 2016, 2014, 0, 2017, 2014, 0, 2016, 2012, 2015, 2016, 2017, 2017, 2016, 2015, 2015, 2014, 2016, 2013, 2015, 2016, 2014, 0, 2014, 2018, 2015, 2018, 2012, 2015, 0, 2013, 0, 2012, 2017, 2014, 2017, 2016, 2018, 2014, 2016, 2018, 0, 2014, 2014, 2018, 2013, 2015, 0, 2018, 2015, 2013, 2017, 2015, 0, 2013, 2014, 2016, 2017, 2015, 2015, 2018, 2014, 2014, 2014, 2017, 2017, 2015, 2015, 2014, 2016, 2016, 2013, 2014, 2014, 2016, 2017, 2013, 2016, 2017, 2015, 2017, 2015, 2018, 2015, 2018, 2014, 2017, 2017, 2017, 2015, 2015, 0, 2012, 2016, 2015, 2014, 2017, 0, 2018, 2013, 2016, 2014, 2015, 2016, 2016, 0, 2012, 0, 2014, 2015, 2014, 2012, 2018, 2016, 2015, 2013, 2014, 0, 2016, 0, 2018, 2014, 0, 2015, 2016, 2015, 2016, 2013, 2017, 2015, 0, 2014, 2014, 2014, 2015, 2016, 2015, 2014, 2018, 2016, 2015, 2017, 2017, 2016, 2016, 2015, 2014, 2015, 2012, 2016, 2012, 0, 2013, 2018, 2016, 2014, 0, 2017, 2017, 2017, 2016, 0, 2016, 2014, 2016, 0, 0, 2014, 2013, 2016, 2017, 2014, 2015, 2014, 2016, 2017, 2017, 2015, 2016, 2018, 2014, 0, 0, 2016, 2015, 2013, 2012, 2014, 2015, 2015, 2017, 2013, 2013, 2012, 2012, 2016, 2013, 2017, 2012, 2013, 2016, 2015, 2017, 2017, 2014, 2018, 2015, 0, 2014, 2018, 2017, 2014, 2013, 2014, 2012, 2018, 2015, 2018, 2013, 2017, 2016, 2014, 2014, 2014, 2016, 2014, 2013, 2017, 2013, 2015, 2016, 2015, 2014, 2018, 2015, 2017, 2014, 2014, 2016, 2017, 2013, 2014, 2013, 2015, 2015, 2013, 2014, 2017, 2018, 2018, 2015, 2014, 0, 2014, 2017, 2017, 2017, 2014, 2015, 0, 2016, 2018, 2016, 2016, 2013, 2018, 2015, 2016, 2017, 2013, 2017, 0, 2015, 2012, 0, 2015, 2014, 2012, 0, 2015, 2012, 2017, 2017, 0, 2018, 2015, 2017, 0, 2016, 2013, 2018, 2015, 2018, 0, 2014, 2014, 2018, 2015, 2017, 2013, 2015, 2017, 2015, 2017, 2016, 2016, 2016, 2015, 2015, 2016, 2014, 2012, 2016, 2014, 2016, 2016, 2016, 2014, 2014, 2015, 2016, 2013, 2017, 2015, 2015, 2013, 2016, 2016, 2016, 2013, 2014, 2013, 2014, 2015, 2018, 2018, 2016, 0, 2016, 2015, 2015, 2014, 2014, 2017, 2015, 0, 2013, 2017, 2016, 0, 2014, 2017, 2017, 2017, 2012, 2017, 2018, 2016, 2016, 2016, 2015, 0, 2016, 0, 2015, 2013, 0, 2013, 2014, 2014, 2017, 2017, 2014, 2013, 2016, 2015, 2017, 2014, 2014, 2017, 2015, 2016, 2018, 2016, 2017, 2013, 0, 2017, 2017, 2014, 2018, 2013, 0, 2015, 2014, 2015, 2017, 2016, 2015, 2016, 2014, 2018, 2014, 2013, 2015, 2013, 2016, 2014, 2018, 0, 2017, 2014, 2016, 2017, 2017, 2017, 2016, 0, 2012, 2013, 2015, 2013, 2017, 2014, 2015, 2015, 2013, 0, 2014, 2016, 2015, 2016, 2014, 2017, 2015, 2014, 2014, 2014, 0, 2018, 2014, 2013, 2016, 2016, 2016, 2014, 2015, 2018, 2015, 2017, 2015, 2013, 2016, 2018, 2012, 0, 2014, 0, 2013, 2016, 2015, 2013, 2017, 2015, 2014, 2015, 2017, 2015, 2012, 2014, 2016, 2017, 2015, 2017, 2018, 2017, 2014, 2016, 2012, 2016, 2017, 2015, 2016, 2018, 2016, 2018, 2013, 2014, 2013, 2014, 2016, 2017, 2014, 2015, 2014, 2016, 2017, 0, 2014, 2016, 2018, 2016, 2016, 2014, 2015, 2015, 2016, 2016, 2017, 2012, 2015, 2017, 2014, 2013, 2017, 2013, 2018, 0, 2015, 2015, 2018, 2018, 2017, 2015, 2014, 2014, 2018, 2013, 2015, 2016, 2015, 2014, 2018, 2017, 2018, 0, 2014, 2018, 2017, 2016, 2014, 0, 2018, 2018, 2018, 2016, 2015, 2017, 2013, 0, 2015, 2012, 2015, 2014, 0, 2015, 2016, 2015, 2015, 2014, 2012]",0,0,0,1,0,0,1
"To make full use of research data, the bioscience community needs to adopt technologies and reward mechanisms that support interoperability and promote the growth of an open 'data commoning' culture. Here we describe the prerequisites for data commoning and present an established and growing ecosystem of solutions using the shared 'Investigation-Study-Assay' framework to support that vision.",0.0,Toward interoperable bioscience data.,0.0,"Shamu CE, Sansone SA, Rocca-Serra P, Field D, Maguire E, Taylor C, Hofmann O, Fang H, Neumann S, Tong W, Amaral-Zettler L, Begley K, Booth T, Bougueleret L, Burns G, Chapman B, Clark T, Coleman LA, Copeland J, Das S, de Daruvar A, de Matos P, Dix I, Edmunds S, Evelo CT, Forster MJ, Gaudet P, Gilbert J, Goble C, Griffin JL, Jacob D, Kleinjans J, Harland L, Haug K, Hermjakob H, Ho Sui SJ, Laederach A, Liang S, Marshall S, McGrath A, Merrill E, Reilly D, Roux M, Shang CA, Steinbeck C, Trefethen A, Williams-Jones B, Wolstencroft K, Xenarios I, Hide W",,1.0,,5/19/16 18:33,0.0,0.0,0.0,1.0,10.1038/ng.1054,2,Nature Genetics,,22281772.0,PMC3428019,121-6,39.0,,0.0,,,0.0,0.0,5/19/16 18:33,44,2012.0,PMC3428019,"['3547282', '3459841', '4660926', '3708619', '3608878', '3387801', '4374589', '4054689', '5447233', '4255881', '5265702', '4247478', '5066505', '4778387', '4161829', '3598649', '4958338', '3964625', '3568360', '5939963', '4338824', '4006037', '3626507', '3658998', '4702362', '4255883', '4434901', '4309925', '5748570', '5627583', '4495984', '3638156', '4288071', '3617453', '4310165', '5490836', '4419759', '3465651', '3720848', '6069748', '4648992', '3531110', '4120729', '3648359', '4080583', '6056554', '4520230', '3965009', '4557916', '5344029', '4110348', '5862271', '4175511', '5593109', '3950661', '3771067', '3626509', '4254674', '5367812', '4578352', '4285398', '3932466', '5855952', '4782059', '4255742', '3632999', '5459929', '4851331', '5536224', '3639071', '3989035', '3580496', '4890512', '4331705', '4792175', '4603302', '3570217', '3523315', '4792520', '4940433', '4975040', '5440521', '3896927', '5009916', '6031061', '3626512', '4267269', '3558968', '5460592', '4899944', '4015122', '4125964', '4721915']",93.0,"[2013, 2012, 2015, 2013, 2012, 2012, 2015, 0, 2017, 2014, 2017, 2014, 2016, 2015, 2014, 2013, 0, 2013, 2013, 2017, 2015, 2014, 2012, 2013, 2015, 2014, 2015, 2015, 2017, 2017, 2015, 2013, 2014, 2012, 2015, 2016, 2014, 2012, 2013, 2018, 2015, 2012, 2014, 2013, 2014, 2018, 2015, 2013, 2015, 0, 2013, 2016, 2013, 2017, 2014, 2013, 2012, 2014, 2017, 2015, 2015, 2013, 0, 2016, 2014, 2013, 2017, 2016, 2017, 2013, 0, 2012, 2016, 2015, 2016, 2015, 2012, 2012, 2016, 2016, 2014, 2017, 2012, 2015, 2017, 2012, 2014, 2012, 2017, 2016, 2014, 2014, 2016]",0,0,0,0,0,0,0
"Huge amounts of high-throughput screening (HTS) data for probe and drug development projects are being generated in the pharmaceutical industry and more recently in the public sector. The resulting experimental datasets are increasingly being disseminated via publically accessible repositories. However, existing repositories lack sufficient metadata to describe the experiments and are often difficult to navigate by non-experts. The lack of standardized descriptions and semantics of biological assays and screening results hinder targeted data retrieval, integration, aggregation, and analyses across different HTS datasets, for example to infer mechanisms of action of small molecule perturbagens. To address these limitations, we created the BioAssay Ontology (BAO). BAO has been developed with a focus on data integration and analysis enabling the classification of assays and screening results by concepts that relate to format, assay design, technology, target, and endpoint. Previously, we reported on the higher-level design of BAO and on the semantic querying capabilities offered by the ontology-indexed triple store of HTS data. Here, we report on our detailed design, annotation pipeline, substantially enlarged annotation knowledgebase, and analysis results. We used BAO to annotate assays from the largest public HTS data repository, PubChem, and demonstrate its utility to categorize and analyze diverse HTS results from numerous experiments. BAO is publically available from the NCBO BioPortal at http://bioportal.bioontology.org/ontologies/1533. BAO provides controlled terminology and uniform scope to report probe and drug discovery screening assays and results. BAO leverages description logic to formalize the domain knowledge and facilitate the semantic integration with diverse other resources. As a consequence, BAO offers the potential to infer new knowledge from a corpus of assay results, for example molecular mechanisms of action of perturbagens.",0.0,"Formalization, annotation and analysis of diverse drug and probe screening assay datasets using the BioAssay Ontology (BAO).",0.0,"Schürer SC, Visser U, Abeyruwan S, Vempati UD, Mir A, Sakurai K, Chung C, Przydzial MJ, Lemmon VP",,1.0,,5/19/16 18:33,1.0,0.0,1.0,1.0,10.1371/journal.pone.0049198,11,PLoS One,,23155465.0,PMC3498356,e49198,40.0,"{\BAO\"":\""http://bioportal.bioontology.org/ontologies/1533\""}""",0.0,,,0.0,1.0,5/19/16 18:33,7,2012.0,PMC3498356,"['4943296', '6007090', '5031183', '4270162', '4383997', '4510462', '4568956', '4137659', '3842764', '6004408', '4468040', '4108877', '4614911', '5753343', '5679337', '4387853', '4562159', '4884375']",18.0,"[2016, 2018, 2016, 0, 2014, 2015, 2015, 2014, 2013, 2018, 2014, 2014, 2015, 2017, 2017, 2014, 2015, 2016]",0,0,0,0,0,0,0
