abstract,analytical_method_development,article_name,assay_development,authors,center,center_pub,comments,created_at,data_analysis,data_generation,data_integration,data_standards,doi,issue,journal_name,other_link,pm_id,pmc_id,pp_pages,publication_id,resource_links,review,scopus_citations,show_at_home_order,signature_generation,software_development,updated_at,volume,year_published,PMCID,citations,n_citations,citation_years,DCIC,Drug Toxicity,Proteomics,Microenvironment,HMS,Transcriptomics,NeuroLINCS
"Activation of synovial fibroblasts (SFs) contributes to rheumatoid arthritis (RA) by damaging synovial membranes and generating inflammatory cytokines that recruit immune cells to the joint. In this paper we profile cytokine secretion by primary human SFs from healthy tissues and from donors with RA and show that SF activation by TNF, IL-1α, and polyinosinic-polycytidylic acid (Poly(I:C)) cause secretion of multiple cytokines found at high levels in RA synovial fluids. We used interaction multiple linear regression to quantify therapeutic and countertherapeutic drug effects across activators and donors and found that the ability of drugs to block SF activation was strongly dependent on the identity of the activating cytokine. (5z)-7-oxozeaenol (5ZO), a preclinical drug that targets transforming growth factor-β-activated kinase 1 (TAK1), was more effective at blocking SF activation across all contexts than the approved drug tofacitinib, which supports the development of molecules similar to 5ZO for use as RA therapeutics.",0.0,Profiling drugs for rheumatoid arthritis that inhibit synovial fibroblast activation.,0.0,"Jones DS, Jenney AP, Swantek JL, Burke JM, Lauffenburger DA, Sorger PK",,1.0,,11/28/16 0:00,1.0,1.0,0.0,0.0,10.1038/nchembio.2211,1,Nature Chemical Biology,,27820799.0,,38-45,106.0,"{\Publication Summary\"": \""http://lincs.hms.harvard.edu/jones-natchembiol-2016/\""}""",0.0,,,1.0,0.0,,13,2016.0,PMC5372219,"['5978689', '5932757', '5652455', '5702485', '5576570', '5797482', '5484535', '5972226']",8.0,"[2018, 2018, 2017, 2017, 0, 2018, 2016, 2018]",0,0,0,0,1,0,0
"Neuronal inclusions of poly(GA), a protein unconventionally translated from G4C2 repeat expansions in C9ORF72, are abundant in patients with frontotemporal dementia (FTD) and amyotrophic lateral sclerosis (ALS) caused by this mutation. To investigate poly(GA) toxicity, we generated mice that exhibit poly(GA) pathology, neurodegeneration and behavioral abnormalities reminiscent of FTD and ALS. These phenotypes occurred in the absence of TDP-43 pathology and required poly(GA) aggregation. HR23 proteins involved in proteasomal degradation and proteins involved in nucleocytoplasmic transport were sequestered by poly(GA) in these mice. HR23A and HR23B similarly colocalized to poly(GA) inclusions in C9ORF72 expansion carriers. Sequestration was accompanied by an accumulation of ubiquitinated proteins and decreased xeroderma pigmentosum C (XPC) levels in mice, indicative of HR23A and HR23B dysfunction. Restoring HR23B levels attenuated poly(GA) aggregation and rescued poly(GA)-induced toxicity in neuronal cultures. These data demonstrate that sequestration and impairment of nuclear HR23 and nucleocytoplasmic transport proteins is an outcome of, and a contributor to, poly(GA) pathology.",0.0,C9ORF72 poly(GA) aggregates sequester and impair HR23 and nucleocytoplasmic transport proteins.,0.0,"Zhang YJ, Gendron TF, Grima JC, Sasaguri H, Jansen-West K, Xu YF, Katzman RB, Gass J, Murray ME, Shinohara M, Lin WL, Garrett A, Stankowski JN, Daughrity L, Tong J, Perkerson EA, Yue M, Chew J, Castanedes-Casey M, Kurti A,  Wang ZS, Liesinger AM, Baker JD, Jiang J, Lagier-Tourenne C, Edbauer D, Cleveland DW, Rademakers R, Boylan KB, Bu G, Link CD, Dickey CA, Rothstein JD, Dickson DW, Fryer JD, Petrucelli L",,1.0,,12/21/16 0:00,0.0,1.0,0.0,0.0,10.1038/nn.4272,5,Nature Neuroscience,,26998601.0,PMC5138863 ,668-77,108.0,,0.0,,,0.0,0.0,,19,2016.0,PMC5138863,"['5754368', '5111366', '5800968', '5722904', '5498553', '5479704', '4916865', '5678982', '5641681', '5078984', '5736982', '5282547', '5148671', '4860075', '4925306', '5788550', '5303742', '5833700', '5079111', '6031111', '5508040', '6083872', '5568450', '5504096', '5886201', '5562674', '5263258', '5935138', '5237533', '6010627', '5427168', '4947127', '5595097', '5536911', '5585017', '5760849', '5864209', '5666671', '5578434', '6035389', '5003651', '5409121', '5989578', '5415567', '5951168']",45.0,"[2018, 2016, 2018, 2017, 2017, 0, 2016, 0, 2017, 0, 2017, 2017, 2016, 2016, 2016, 2017, 2017, 2018, 0, 2018, 2017, 2018, 2017, 2017, 2017, 2017, 0, 2017, 2017, 0, 2017, 2016, 0, 0, 0, 2017, 2018, 0, 2017, 2018, 2016, 2016, 2018, 2017, 2017]",0,0,0,0,0,0,1
"The hexanucleotide repeat expansion (HRE) GGGGCC (G4C2) in C9orf72 is the most common cause of amyotrophic lateral sclerosis (ALS) and frontotemporal dementia (FTD). Recent studies support an HRE RNA gain-of-function mechanism of neurotoxicity, and we previously identified protein interactors for the G4C2 RNA including RanGAP1. A candidate-based genetic screen in Drosophila expressing 30 G4C2 repeats identified RanGAP (Drosophila orthologue of human RanGAP1), a key regulator of nucleocytoplasmic transport, as a potent suppressor of neurodegeneration. Enhancing nuclear import or suppressing nuclear export of proteins also suppresses neurodegeneration. RanGAP physically interacts with HRE RNA and is mislocalized in HRE-expressing flies, neurons from C9orf72 ALS patient-derived induced pluripotent stem cells (iPSC-derived neurons), and in C9orf72 ALS patient brain tissue. Nuclear import is impaired as a result of HRE expression in the fly model and in C9orf72 iPSC-derived neurons, and these deficits are rescued by small molecules and antisense oligonucleotides targeting the HRE G-quadruplexes. Nucleocytoplasmic transport defects may be a fundamental pathway for ALS and FTD that is amenable to pharmacotherapeutic intervention.",0.0,The C9orf72 repeat expansion disrupts nucleocytoplasmic transport.,0.0,"Zhang K, Donnelly CJ, Haeusler AR, Grima JC, Machamer JB, Steinwald P, Daley EL, Miller SJ, Cunningham KM, Vidensky S, Gupta S, Thomas MA, Hong I, Chiu SL, Huganir RL, Ostrow LW, Matunis MJ, Wang J, Sattler R, Lloyd TE, Rothstein J",,1.0,,12/21/16 0:00,0.0,1.0,0.0,0.0,10.1038/nature14973,7567,Nature,,26308891.0,PMC4800742,56-61,109.0,,0.0,,,0.0,0.0,,525,2016.0,PMC4800742,"['5207208', '5111366', '4652136', '5177458', '5836993', '5584738', '5449186', '5935713', '4787773', '5997509', '5647251', '4793236', '5641681', '4854189', '4946918', '5733489', '4872077', '5840287', '5580514', '5917746', '5303742', '6034118', '5758912', '5833700', '5009743', '5846449', '5769772', '5063613', '6098723', '5524429', '6031111', '6083872', '5568450', '5101148', '5555642', '4751451', '5295673', '5074894', '6063327', '6054632', '5935138', '5677592', '5003667', '5854632', '5095402', '4797287', '4905271', '4814715', '5886095', '4700483', '4655160', '5799296', '5504081', '5409181', '5833406', '5722904', '5479704', '5678982', '5320981', '5946852', '5181624', '5815878', '5574247', '4993645', '5003654', '5788550', '5333049', '5423993', '5079111', '5119725', '5816713', '5359753', '5087727', '4947123', '5263258', '6010627', '5283830', '5997512', '5536911', '5585017', '5451175', '5893388', '5003651', '4761318', '5998080', '5120541', '5070503', '5653973', '4761393', '5800968', '5409076', '4916865', '4864155', '4862319', '5951168', '4832459', '5873302', '5007570', '5468954', '5314733', '5479438', '5669558', '5857577', '5148671', '4860075', '4925306', '5993797', '5504286', '4672084', '5108435', '4938715', '5403602', '5826050', '5504096', '5991088', '5842509', '4947127', '5306383', '4842317', '5886083', '4596656', '4910533', '5409121', '5879878', '5754368', '5321024', '5138863', '4826116', '5498553', '5723708', '5500981', '5886148', '5389700', '5576451', '4758954', '5279714', '4766718', '5282547', '4764581', '4840312', '5071740', '5679478', '5997521', '5674072', '5451164', '6015541', '5812426', '5050020', '5390134', '5562674', '5179919', '5237533', '5077081', '5447490', '5790143', '5783946', '5451163', '5985154', '4916312', '5387085', '5989578', '5415567', '4916884', '5427168', '5964256']",165.0,"[2016, 2016, 2015, 2016, 2017, 2016, 2017, 2018, 2015, 2018, 2017, 2016, 2017, 2016, 2016, 2017, 2016, 2018, 2017, 2018, 2017, 2018, 2017, 2018, 2016, 2018, 0, 0, 2018, 2017, 2018, 2018, 2017, 2016, 2017, 2016, 2017, 2016, 2018, 2018, 2017, 2017, 2016, 2018, 2016, 2016, 2015, 2016, 2017, 0, 2015, 2018, 2017, 2017, 2018, 2017, 0, 0, 2017, 2018, 2016, 2018, 2017, 2016, 2016, 2017, 2017, 2017, 0, 2016, 2017, 2017, 2016, 2016, 0, 0, 2017, 2018, 0, 0, 0, 2018, 2016, 2015, 2018, 0, 2016, 0, 2016, 2018, 2017, 2016, 2015, 2016, 2017, 2016, 2017, 2016, 2017, 2017, 2017, 2017, 2018, 2016, 2016, 2016, 2018, 2017, 2015, 2016, 2016, 2017, 0, 2017, 0, 2017, 2016, 2017, 0, 2017, 2015, 2016, 2016, 0, 2018, 2017, 2016, 2015, 2017, 0, 2016, 2017, 2016, 0, 2015, 2016, 2016, 2017, 2016, 2016, 2016, 0, 2018, 2017, 0, 2018, 2018, 2016, 2017, 2017, 2016, 2017, 2016, 2017, 2016, 2018, 0, 2017, 2016, 2017, 2018, 2017, 2016, 2017, 2018]",0,0,0,0,0,0,1
"While developing a multiplexed phosphotyrosine peptide quantification assay, an unexpected observation was made: significant neutral loss from phosphotyrosine (pY) containing peptides. Using a 2000-member peptide library, we sought to systematically investigate this observation by comparing unlabeled peptides with the two highest-plex isobaric tags (iTRAQ8 and TMT10) across CID, HCD, and ETD fragmentation using high resolution high mass accuracy Orbitrap instrumentation. We found pY peptide neutral loss behavior was consistent with reduced proton mobility, and does not occur during ETD. The site of protonation at the peptide N-terminus changes from a primary to a tertiary amine as a result of TMT labeling which would increase the gas phase basicity and reduce proton mobility at this site. This change in fragmentation behavior has implications during instrument method development and interpretation of MS/MS spectra, and therefore ensuing follow-up studies. We show how sites not localized to tyrosine by search and site localization algorithms can be confidently reassigned to tyrosine using neutral loss and phosphotyrosine immonium ions. We believe these findings will be of general interest to those studying pY signal transduction using isobaric tags.",1.0,Neutral loss is a very common occurrence in phosphotyrosine-containing peptides labeled with isobaric tags.,0.0,"Everley RA, Huttlin EL, Erickson AR, Beausoleil SA, Gygi SP",,1.0,,1/13/17 0:00,0.0,0.0,0.0,0.0,10.1021/acs.jproteome.6b00487,2,Journal of Proteome Research,,27978624.0,,1069-1076,122.0,,0.0,,,0.0,0.0,,16,2016.0,PMC5479408,[],0.0,,0,0,0,0,0,0,0
,,"Signaling Networks among Stem Cell Precursors, Transit-Amplifying Progenitors, and their Niche in Developing Hair Follicles.",,"Rezza A,Wang Z,Sennett R,Qiao W,Wang D,Heitman N,Mok KW,Clavel C,Yi R,Zandstra P,Ma'ayan A,Rendl M",DCIC,1.0,funded in part by LINCS,,,,,,,,,,27009580.0,,,214.0,,,24.0,,,,,,2016.0,PMC4826467,"['5561490', '5944606', '5556613', '5327925', '6023175', '6042872', '5519926', '5701154', '5482241', '5681350', '5968378', '5394399', '5352137', '5979429']",14.0,"[2017, 0, 2017, 2017, 2018, 2018, 2017, 2017, 0, 0, 2018, 2017, 2017, 2018]",1,0,0,0,0,0,0
,,Fetal liver hematopoietic stem cell niches associate with portal vessels,,"Khan JA,Mendelson A,Kunisaki Y,Birbrair A,Kou Y,Arnal-Estapé A,Pinho S,Ciero P, Nakahara F, Ma'ayan A, Bergman A, Merad M, Frenette PS",DCIC,1.0,funded in part by LINCS,,,,,,,,,,26634440.0,,,214.0,,,62.0,,,,,,2016.0,PMC4706788,"['5467892', '6087893', '6089363', '5494437', '5993650', '6044472', '5830911', '5825844', '6089873', '5724390', '5960588', '5827742', '6013359', '5642943', '5953202', '6030356', '5619995', '4938003', '6067923', '5752497', '5201026', '5512298', '6076852', '5746544', '5468376', '5442811', '6076854', '6069997', '6103525', '5731410', '5206491', '5330741', '5911609', '6093188', '5872840', '6092246']",36.0,"[2017, 2018, 2018, 2017, 2018, 2018, 2018, 0, 2017, 2017, 2018, 2018, 2018, 2017, 0, 2018, 2017, 2016, 2017, 2017, 0, 2017, 2018, 2017, 2017, 2016, 2017, 2018, 0, 2017, 0, 2017, 2018, 0, 2018, 2017]",1,0,0,0,0,0,0
,,Bisphenol A Disrupts HNF4_-Regulated Gene Networks Linking to Prostate Preneoplasia and Immune Disruption in Noble Rats.,,"Lam HM,Ho SM,Chen J,Medvedovic M,Tam NN",DCIC,1.0,funded in part by LINCS,,,,,,,,,,26496021.0,,,214.0,,,3.0,,,,,,2016.0,PMC4701889,"['5048723', '5413408', '5226663']",3.0,"[2016, 2016, 2016]",1,0,0,0,0,0,0
,,Regulatory consequences of neuronal ELAV-like protein binding to coding and non-coding RNAs in human brain.,,"Scheckel C,Drapeau E,Frias MA,Park CY,Fak J,Zucker-Scharff I,Kou Y,Haroutunian V,Ma'ayan A,Buxbaum JD,Darnell RB",DCIC,1.0,funded in part by LINCS,,,,,,,,,,26894958.0,,,214.0,,,13.0,,,,,,2016.0,PMC4798961,"['5807307', '5859169', '5226212', '5673025', '5972385', '5397167', '5323403', '4930329', '5419255', '5349543', '6060611', '5714957', '5481183']",13.0,"[2018, 2018, 2017, 2017, 0, 2017, 2017, 2016, 2017, 2017, 0, 2017, 2017]",1,0,0,0,0,0,0
,,Glucocorticoid receptor isoforms direct distinct mitochondrial programs to regulate ATPproduction,,"Morgan DJ,Poolman TM,Williamson AJ,Wang Z,Clark NR,Ma'ayan A,Whetton AD,Brass A,Matthews LC,Ray DW",DCIC,1.0,funded in part by LINCS,,,,,,,,,,27226058.0,,,214.0,,,1.0,,,,,,2016.0,PMC4881047,"['5292432', '5438761']",2.0,"[2017, 2017]",1,0,0,0,0,0,0
,,Integrative radiogenomic analysis for multicentric radiophenotype in glioblastoma,,"Kong DS,Kim J,Lee IH,Kim ST,Seol HJ,Lee JI,Park WY,Ryu G,Wang Z,Ma'ayan A,Nam DH",DCIC,1.0,funded in part by LINCS,,,,,,,,,,26863628.0,,,214.0,,,4.0,,,,,,2016.0,PMC4905491,[],0.0,,1,0,0,0,0,0,0
"Treatment of BRAF-mutant melanomas with MAP kinase pathway inhibitors is paradigmatic of the promise of precision cancer therapy but also highlights problems with drug resistance that limit patient benefit. We use live-cell imaging, single-cell analysis, and molecular profiling to show that exposure of tumor cells to RAF/MEK inhibitors elicits a heterogeneous response in which some cells die, some arrest, and the remainder adapt to drug. Drug-adapted cells up-regulate markers of the neural crest (e.g., NGFR), a melanocyte precursor, and grow slowly. This phenotype is transiently stable, reverting to the drug-naïve state within 9 days of drug withdrawal. Transcriptional profiling of cell lines and human tumors implicates a c-Jun/ECM/FAK/Src cascade in de-differentiation in about one-third of cell lines studied; drug-induced changes in c-Jun and NGFR levels are also observed in xenograft and human tumors. Drugs targeting the c-Jun/ECM/FAK/Src cascade as well as BET bromodomain inhibitors increase the maximum effect (Emax) of RAF/MEK kinase inhibitors by promoting cell killing. Thus, analysis of reversible drug resistance at a single-cell level identifies signaling pathways and inhibitory drugs missed by assays that focus on cell populations.",0.0,Adaptive resistance of melanoma cells to RAF inhibition via reversible induction of a slowly dividing de-differentiated state.,0.0,"Fallahi-Sichani M, Becker V, Izar B, Baker GJ, Lin JR, Boswell SA, Shah P, Rotem A, Garraway LA, Sorger PK",,1.0,,1/13/17 0:00,1.0,1.0,1.0,0.0,10.15252/msb.20166796,1,Molecular Systems Biology,,28069687.0,PMC5248573,905,120.0,"{\Publication Summary\"":\""http://lincs.hms.harvard.edu/fallahi-sichani-molsystbiol-2017/\""}""",0.0,,,1.0,0.0,,13,2017.0,PMC5248573,"['6063884', '5748184', '5997492', '5938620', '5845637', '6089072', '5725273', '5760019', '5248573', '6077126', '5671412', '5953834', '5883941', '5753657', '5902511', '5532606', '5799026']",17.0,"[2018, 2017, 2017, 2018, 2018, 2017, 0, 2018, 2017, 2018, 2017, 2018, 2018, 2017, 2018, 2017, 2017]",0,0,0,0,1,0,0
"Drug repurposing, the application of an existing therapeutic to a new disease indication, holds promise of rapid clinical impact at a lower cost than de novo drug development. So far, there has not been a systematic effort to identify such opportunities, limited in part by the lack of a comprehensive library of clinical compounds suitable for testing. To address this challenge, we hand-curated a collection of 4,707 compounds, experimentally confirmed their identities, and annotated them with literature-reported targets. The collection includes 3,422 drugs that are marketed around the world or that have been tested in human clinical trials. Compounds were obtained from more than 50 chemical vendors, and the purity of each sample was established. We have thus established a blueprint for others to easily assemble such a repurposing library, and we have created an online Drug Repurposing Hub (http://www.broadinstitute.org/repurposing) that contains detailed annotation for each of the compounds.",0.0,The Drug Repurposing Hub: a next-generation drug library and information resource.,0.0,"Corsello SM, Bittker JA, Liu Z, Gould J, McCarren P, Hirschman JE, Johnston SE, Vrcic A, Wong B, Khan M, Asiedu J, Narayan R, Mader CC, Subramanian A, Golub TR",,1.0,,4/11/17 0:00,1.0,1.0,1.0,0.0,10.1038/nm.4306,4,Nature Medicine,,28388612.0,,405-408,130.0,"{\Drug Repurposing Hub\"": \""https://clue.io/repurposing\""}""",0.0,,,0.0,1.0,,23,2017.0,PMC5568558,"['6083343', '5864870', '5805407', '5918430', '5753377', '5814751', '6027196', '6029548', '5805620', '5759325', '5820538', '5990023', '5844338', '5709193', '5712546', '6070956', '6042083', '6022535', '6063895', '5857178', '5835698', '5944452', '5898022']",23.0,"[2018, 2018, 2018, 2018, 2017, 0, 2018, 0, 2017, 2017, 2018, 0, 2018, 2017, 2017, 2018, 2018, 2018, 2018, 0, 2018, 2018, 2018]",0,0,1,0,0,1,0
"The volume and diversity of data in biomedical research has been rapidly increasing in recent years. While such data hold significant promise for accelerating discovery, their use entails many challenges including: the need for adequate computational infrastructure, secure processes for data sharing and access, tools that allow researchers to find and integrate diverse datasets, and standardized methods of analysis. These are just some elements of a complex ecosystem that needs to be built to support the rapid accumulation of these data. The NIH Big Data to Knowledge (BD2K) initiative aims to facilitate digitally enabled biomedical research. Within the BD2K framework, the Commons initiative is intended to establish a virtual environment that will facilitate the use, interoperability, and discoverability of shared digital objects used for research. The BD2K Commons Framework Pilots Working Group (CFPWG) was established to clarify goals and work on pilot projects that would address existing gaps toward realizing the vision of the BD2K Commons. This report reviews highlights from a two-day meeting involving the BD2K CFPWG to provide insights on trends and considerations in advancing Big Data science for biomedical research in the United States.",0.0,Developing a framework for digital objects in the Big Data to Knowledge (BD2K) Commons: Report from the Commons Framework Pilots Workshop.,0.0,"Jagodnik KM, Koplev S, Jenkins S, Ohno-Machado L, Paten B, Schurer SC, Dumontier M, Verborgh R, Bui A, Ping P, McKenna NJ, Madduri R, Pillai A, Ma'ayan A",,1.0,,5/31/17 0:00,0.0,0.0,0.0,0.0,10.1016/j.jbi.2017.05.006,17,Journal of Biomedical Informatics,,28501646.0,,30101-30106,132.0,"{\Harmonizome\"":\""http://amp.pharm.mssm.edu/Harmonizome\"", \""Big Data Science MOOC\"":\""https://www.coursera.org/learn/bd2k-lincs\"",\""BD2K-LINCS DCIC website\"":\""http://lincs-dcic.org/#/\""}""",1.0,,,0.0,0.0,,pii: S1532-0464,2017.0,PMC5545976,"['5963703', '6002019', '5827688', '6007090']",4.0,"[0, 2018, 2018, 2018]",1,0,0,0,0,0,0
"Brain microvascular endothelial cells (BMECs) are an essential component of the blood-brain barrier (BBB) that shields the brain against toxins and immune cells. While BBB dysfunction exists in neurological disorders, including Huntington's disease (HD), it is not known if BMECs themselves are functionally compromised to promote BBB dysfunction. Further, the underlying mechanisms of BBB dysfunction remain elusive given limitations with mouse models and post-mortem tissue to identify primary deficits. We undertook a transcriptome and functional analysis of human induced pluripotent stem cell (iPSC)-derived BMECs (iBMEC) from HD patients or unaffected controls. We demonstrate that HD iBMECs have intrinsic abnormalities in angiogenesis and barrier properties, as well as in signaling pathways governing these processes. Thus, our findings provide an iPSC-derived BBB model for a neurodegenerative disease and demonstrate autonomous neurovascular deficits that may underlie HD pathology with implications for therapeutics and drug delivery.",0.0,Huntington's disease iPSC-derived brain microvascular endothelial cells reveal WNT-mediated angiogenic and blood-brain barrier deficits.,0.0,"Lim RG, Quan C, Reyes-Ortiz AM, Lutz SE, Kedaigle AJ, Gipson TA, Wu J, Vatine GD, Stocksdale J, Casale MS, Svendsen CN, Fraenkel E, Housman DE, Agalliu D, Thompson LM",,1.0,,6/14/17 0:00,1.0,1.0,0.0,0.0,10.1016/j.celrep.2017.04.021,7,Cell Reports,,28514657.0,,1365-1377,138.0,,0.0,,,0.0,0.0,,19,2017.0,PMC5646270,"['5668574', '5819713', '5663983', '5728434', '5812426', '6080833', '5713119', '5789839', '5883398', '5959231', '5696836', '5951019', '5658344', '5797533']",14.0,"[2017, 2018, 2017, 2017, 2018, 2018, 2017, 2018, 2018, 0, 0, 2017, 2017, 2018]",0,0,0,0,0,0,1
"The U1 small nuclear (sn)RNA (U1) is a multifunctional ncRNA, known for its pivotal role in pre-mRNA splicing and regulation of RNA 3' end processing events. We recently demonstrated that a new class of human U1-like snRNAs, the variant (v)U1 snRNAs (vU1s), also participate in pre-mRNA processing events. In this study, we show that several human vU1 genes are specifically upregulated in stem cells and participate in the regulation of cell fate decisions. Significantly, ectopic expression of vU1 genes in human skin fibroblasts leads to increases in levels of key pluripotent stem cell mRNA markers, including NANOG and SOX2. These results reveal an important role for vU1s in the control of key regulatory networks orchestrating the transitions between stem cell maintenance and differentiation. Moreover, vU1 expression varies inversely with U1 expression during differentiation and cell re-programming and this pattern of expression is specifically de-regulated in iPSC-derived motor neurons from Spinal Muscular Atrophy (SMA) type 1 patient's. Accordingly, we suggest that an imbalance in the vU1/U1 ratio, rather than an overall reduction in Uridyl-rich (U)-snRNAs, may contribute to the specific neuromuscular disease phenotype associated with SMA.",0.0,Variant U1 snRNAs are implicated in human pluripotent stem cell maintenance and neuromuscular disease.,0.0,"Vazquez-Arango P, Vowles J, Browne C, Hartfield E, Fernandes HJ, Mandefro B, Sareen D, James W, Wade-Martins R, Cowley SA, Murphy S, O'Reilly D",,1.0,,6/14/17 0:00,1.0,1.0,0.0,0.0,10.1093/nar/gkw711,22,Nucleic Acids Research,,27536002.0,PMC5159530,10960-10973,139.0,,0.0,,,0.0,0.0,,44,2017.0,PMC5159530,[],0.0,,0,0,0,0,0,0,0
"Neural cultures derived from Huntington's disease (HD) patient-derived induced pluripotent stem cells were used for 'omics' analyses to identify mechanisms underlying neurodegeneration. RNA-seq analysis identified genes in glutamate and GABA signaling, axonal guidance and calcium influx whose expression was decreased in HD cultures. One-third of gene changes were in pathways regulating neuronal development and maturation. When mapped to stages of mouse striatal development, the profiles aligned with earlier embryonic stages of neuronal differentiation. We observed a strong correlation between HD-related histone marks, gene expression and unique peak profiles associated with dysregulated genes, suggesting a coordinated epigenetic program. Treatment with isoxazole-9, which targets key dysregulated pathways, led to amelioration of expanded polyglutamine repeat-associated phenotypes in neural cells and of cognitive impairment and synaptic pathology in HD model R6/2 mice. These data suggest that mutant huntingtin impairs neurodevelopmental pathways that could disrupt synaptic homeostasis and increase vulnerability to the pathologic consequence of expanded polyglutamine repeats over time.",0.0,Developmental alterations in Huntington's disease neural cells and pharmacological rescue in cells and mice.,0.0,HD iPSC Consortium,,1.0,,6/14/17 0:00,1.0,1.0,0.0,0.0,10.1038/nn.4532,5,Nature Neuroscience,,28319609.0,,648-660,140.0,,0.0,,,0.0,0.0,,20,2017.0,PMC5610046,"['5646270', '6056416', '5789931', '6087435', '6004420']",5.0,"[0, 2018, 2018, 2018, 2018]",0,0,0,0,0,0,0
