abstract,analytical_method_development,article_name,assay_development,authors,center,center_pub,comments,created_at,data_analysis,data_generation,data_integration,data_standards,doi,issue,journal_name,other_link,pm_id,pmc_id,pp_pages,publication_id,resource_links,review,scopus_citations,show_at_home_order,signature_generation,software_development,updated_at,volume,year_published,PMCID,citations,n_citations,citation_years,DCIC,Drug Toxicity,Proteomics,Microenvironment,HMS,Transcriptomics,NeuroLINCS
"A central premise in systems pharmacology is that structurally similar compounds have similar cellular responses; however, this principle often does not hold. One of the most widely used measures of cellular response is gene expression. By integrating gene expression data from Library of Integrated Network-based Cellular Signatures (LINCS) with chemical structure and bioactivity data from PubChem, we performed a large-scale correlation analysis of chemical structures and gene expression profiles of over 11,000 compounds taking into account confounding factors such as biological conditions (e.g., cell line, dose) and bioactivities. We found that structurally similar compounds do indeed yield similar gene expression profiles. There is an ∼20% chance that two structurally similar compounds (Tanimoto Coefficient ≥ 0.85) share significantly similar gene expression profiles. Regardless of structural similarity, two compounds tend to share similar gene expression profiles in a cell line when they are administrated at a higher dose or when the cell line is sensitive to both compounds.",0.0,"Relating chemical structure to cellular response: An integrative analysis of gene expression, bioactivity, and structural data across 11,000 compounds.",0.0,"Chen B, Greenside P, Paik H, Sirota M, Hadley D, Butte AJ",,0.0,,8/30/16 15:51,1.0,0.0,1.0,0.0,10.1002/psp4.12009,10,CPT: Pharmacometrics & Systems Pharmacology,,26535158.0,PMC462586,576-84,85.0,,0.0,,,0.0,0.0,,4,2015.0,PMC4625862,"['5192994', '4907866', '4765895', '5223214', '5752280', '5958072', '5510182', '4845762', '5447464']",9.0,"[2016, 2016, 2016, 2017, 2017, 2018, 2017, 2016, 2017]",0,0,0,0,0,0,0
"The Library of Integrated Network-based Cellular Signatures (LINCS) L1000 big data provide gene expression profiles induced by over 10 000 compounds, shRNAs, and kinase inhibitors using the L1000 platform. We developed csNMF, a systematic compound signature discovery pipeline covering from raw L1000 data processing to drug screening and mechanism generation. The csNMF pipeline demonstrated better performance than the original L1000 pipeline. The discovered compound signatures of breast cancer were consistent with the LINCS KINOMEscan data and were clinically relevant. The csNMF pipeline provided a novel and complete tool to expedite signature-based drug discovery leveraging the LINCS L1000 resources.",1.0,Compound signature detection on LINCS L1000 big data.,0.0,"Liu C, Su J, Yang F, Wei K, Ma J, Zhou X",,0.0,,8/30/16 15:51,1.0,0.0,1.0,0.0,10.1039/c4mb00677a,3,Molecular BioSystems,,25609570.0,PMC433301,714-22,87.0,,0.0,,,0.0,0.0,,11,2015.0,PMC4333019,"['4652136', '5524642', '4625862', '5653784', '5300121', '5763468', '5223214', '4876500', '6047367', '5621916', '5628496', '6072113', '5998894', '4884357', '5532784']",15.0,"[2015, 2017, 2015, 2017, 2017, 2017, 2017, 0, 2018, 2017, 2017, 2018, 2018, 2016, 2017]",0,0,0,0,0,0,0
,,"https://urldefense.proofpoint.com/v2/url?u=http-3A__Geroprotectors.org&d=DwIGow&c=shNJtf5dKgNcPZ6Yh64b-A&r=LrawfOU_mzS8rb8rba8ACnaURrmb7DlO5h4UCgrsh9M&m=G3bZJp47jQauxemcB4gftXwd_RTFDuSerOStHq-8T20&s=jbcIWNVWo5QC1bhWYPDR1dozHujNoWltVhIfZ53VA38&e=: a new, structured and curated database of current therapeutic interventions in aging and age-related disease.",,"Moskalev A,Chernyagina E,de Magalhães JP,Barardo D,Thoppil H,Shaposhnikov M,Budovsky A,Fraifeld VE,Garazha A,Tsvetkov V,Bronovitsky E,Bogomolov V,Scerbacov A,Kuryan O,Gurinovich R,Jellen LC,Kennedy B,Mamoshina P,Dobrovolskaya E,Aliper A,Kaminsky D,Zhavoronkov A",outside,0.0,integrated L1000 database into tool,,,,,,,,,,26342919.0,,,214.0,,,20.0,,,,,,2015.0,PMC4600621,"['4754422', '5753192', '5559171', '5418190', '5008274', '5239441', '5161440', '5611985', '5723685', '4854916', '5865701', '4931851', '5440114', '5539816', '5448074', '5076455', '6052089']",17.0,"[2016, 2017, 2017, 2017, 2016, 2016, 2016, 2017, 2017, 2016, 2018, 2016, 2017, 2017, 2017, 2016, 2018]",0,0,0,0,0,0,0
"Motivation: Multiplex readout assays are now increasingly being performed using microfluidic automation in multiwell format. For instance, the Library of Integrated Network-based Cellular Signatures (LINCS) has produced gene expression measurements for tens of thousands of distinct cell perturbations using a 384-well plate format. This dataset is by far the largest 384-well gene expression measurement assay ever performed. We investigated the gene expression profiles of a million samples from the LINCS dataset and found that the vast majority (96%) of the tested plates were affected by a significant 2D spatial bias. Results: Using a novel algorithm combining spatial autocorrelation detection and principal component analysis, we could remove most of the spatial bias from the LINCS dataset and show in parallel a dramatic improvement of similarity between biological replicates assayed in different plates. The proposed methodology is fully general and can be applied to any highly multiplexed assay performed in multiwell format.",1.0,Detection and removal of spatial bias in multiwell assays.,0.0,"Lachmann A, Giorgi FM, Alvarez MJ, Califano A",,0.0,,8/30/16 15:51,1.0,0.0,0.0,0.0,10.1093/bioinformatics/btw092,13,Bioinformatics,,27153732.0,,1959-65,80.0,,0.0,,,0.0,0.0,,32,2016.0,,,,,0,0,0,0,0,0,0
"Ligand- and structure-based drug design approaches complement phenotypic and target screens, respectively, and are the two major frameworks for guiding early-stage drug discovery efforts. Since the beginning of this century, the advent of the genomic era has presented researchers with a myriad of high throughput biological data (parts lists and their interaction networks) to address efficacy and toxicity, augmenting the traditional ligand- and structure-based approaches. This data rich era has also presented us with challenges related to integrating and analyzing these multi-platform and multi-dimensional datasets and translating them into viable hypotheses. Hence in the present paper, we review these existing approaches to drug discovery research and argue the case for a new systems biology based approach. We present the basic principles and the foundational arguments/underlying assumptions of the systems biology based approaches to drug design. Also discussed are systems biology data types (key entities, their attributes and their relationships with each other, and data models/representations), software and tools used for both retrospective and prospective analysis, and the hypotheses that can be inferred. In addition, we summarize some of the existing resources for a systems biology based drug discovery paradigm (open TG-GATEs, DrugMatrix, CMap and LINCs) in terms of their strengths and limitations.",0.0,Systems Biology approaches to a rational drug discovery paradigm.,0.0,"Prathipati P, Mizuguchi K",,0.0,,8/30/16 15:51,0.0,0.0,0.0,0.0,10.2174/1568026615666150826114524,9,Current Topics in Medicinal Chemistry,,26306988.0,,1009-25,86.0,,1.0,,,0.0,0.0,,16,2016.0,,,,,0,0,0,0,0,0,0
"The present study applies a systems biology approach for the in silico predictive modeling of drug toxicity on the basis of high-quality preclinical drug toxicity data with the aim of increasing the mechanistic understanding of toxic effects of compounds at different levels (pathway, cell, tissue, organ). The model development has been carried out using 77 compounds for which gene expression data are available in the LINCS database for primary human hepatocytes treated with the compounds, as well as rodent in vivo hepatotoxicity information is available in the eTOX database. The data from LINCS were used in a systems biology approach to determine the type and number of pathways disturbed by each compound, and to estimate the extent of disturbance (network perturbation elasticity), analyzing the correspondence with the in vivo information from eTOX. Predictive models were developed through this integrative analysis, and their specificity and sensitivity were assessed. The quality of the predictions was determined on the basis of the area under the curve (AUC) of plots of true positive vs. false positive rates (ROC curves). The ROC AUC reached values of up to 0.9 (out of 1.0) for some hepatotoxicity endpoints. Moreover, the most frequently disturbed metabolic pathways were determined across the studied toxicants. They included e.g. mitochondrial beta-oxidation of fatty acids and amino acid metabolism. The process was exemplified by successful predictions on various statins. In conclusion, an entirely new approach linking gene expression alterations to the prediction of complex organ toxicity has been developed and evaluated.",1.0,Hepatotoxicity prediction by systems biology modeling of disturbed metabolic pathways using gene expression data.,0.0,"Carbonell P, Lopez O, Amberg A, Pastor M, Sanz F",,0.0,,10/24/16 0:00,1.0,0.0,1.0,0.0,10.14573/altex.1602071,2,ALTEX,,27690270.0,,219-234,94.0,,0.0,,,0.0,0.0,,34,2016.0,,,,,0,0,0,0,0,0,0
"Chemical toxicity is conventionally evaluated in animal models. However, animal models are resource intensive; moreover, they face ethical and scientific challenges because the outcomes obtained by animal testing may not correlate with human responses. To develop an alternative method for assessing chemical toxicity, we investigated the feasibility of using chemical-induced genome-wide expression changes in cultured human cells to predict the potential of a chemical to cause specific organ injuries in humans. We first created signatures of chemical-induced gene expression in a vertebral-cancer of the prostate cell line for ~15,000 chemicals tested in the U.S. National Institutes of Health Library of Integrated Network-based Cellular Signatures program. We then used the signatures to create naïve Bayesian prediction models for chemical-induced human liver cholestasis, interstitial nephritis, and long QT syndrome. Detailed cross-validation analyses indicated that the models were robust with respect to false positives and false negatives in the samples we used to train the models, and could predict the likelihood that chemicals would cause specific organ injuries. In addition, we performed a literature search for drugs and dietary supplements, not formally categorized as causing organ injuries in humans but predicted by our models to be most likely to do so. We found a high percentage of these compounds associated with case reports of relevant organ injuries, lending support to the idea that in vitro cell-based experiments can be used to predict the toxic potential of chemicals. We believe that this approach, combined with a robust technique to model human exposure to chemicals, may serve as a promising alternative to animal-based chemical toxicity assessment.",1.0,Using chemical-induced gene expression in cultured human cells to predict chemical toxicity.,0.0,"Liu R, Yu X, Wallqvist A",,0.0,,10/29/16 16:00,1.0,0.0,0.0,0.0,,11,Chemical Research in Toxicology,,27768846.0,,1883-1893,96.0,,0.0,,,0.0,0.0,,29,2016.0,,,,,0,0,0,0,0,0,0
"Cancer cell lines grown as two-dimensional (2D) cultures have been an essential model for studying cancer biology and anticancer drug discovery. However, 2D cancer cell cultures have major limitations, as they do not closely mimic the heterogeneity and tissue context of in vivo tumors. Developing three-dimensional (3D) cell cultures, such as multicellular tumor spheroids, has the potential to address some of these limitations. Here, we combined a high-throughput gene expression profiling method with a tumor spheroid-based drug-screening assay to identify context-dependent treatment responses. As a proof of concept, we examined drug responses of quiescent cancer cells to oxidative phosphorylation (OXPHOS) inhibitors. Use of multicellular tumor spheroids led to discovery that the mevalonate pathway is upregulated in quiescent cells during OXPHOS inhibition, and that OXPHOS inhibitors and mevalonate pathway inhibitors were synergistically toxic to quiescent spheroids. This work illustrates how 3D cellular models yield functional and mechanistic insights not accessible via 2D cultures.",1.0,Large-scale gene expression profiling platform for identification of context-dependent drug responses in multicellular tumor spheroids.,0.0,"Senkowski W, Jarvius M, Rubin J, Lengqvist J, Gustafsson MG, Nygren P, Kultima K, Larsson R, Fryknas M",,0.0,,11/9/16 0:00,1.0,0.0,0.0,0.0,10.1016/j.chembiol.2016.09.013,11,Cell Chemical Biology,http://www.sciencedirect.com/science/article/pii/S2451945616303531,27984028.0,,1428-1438,103.0,,0.0,,,0.0,0.0,,23,2016.0,,,,,0,0,0,0,0,0,0
"Unbiased binding assays involving small-molecule microarrays were used to identify compounds that display unique patterns of selectivity among members of the zinc-dependent histone deacetylase family of enzymes. A novel, hydroxyquinoline-containing compound, BRD4354, was shown to preferentially inhibit activity of HDAC5 and HDAC9 in vitro. Inhibition of deacetylase activity appears to be time-dependent and reversible. Mechanistic studies suggest that the compound undergoes zinc-catalyzed decomposition to an ortho-quinone methide, which covalently modifies nucleophilic cysteines within the proteins. The covalent nature of the compound-enzyme interaction has been demonstrated in experiments with biotinylated probe compound and with electrospray ionization-mass spectrometry.",0.0,Inhibition of zinc-dependent histone deacetylases with a chemically triggered electrophile.,0.0,"Boskovic ZV, Kemp MM, Freedy AM, Viswanathan VS, Pop MS, Fuller JH, Martinez NM, Figueroa Lazú SO, Hong JA, Lewis TA, Calarese D, Love JD, Vetere A, Almo SC, Schreiber SL, Koehler AN",,0.0,,1/13/17 0:00,1.0,1.0,0.0,0.0,10.1021/acschembio.6b00012,7,ACS Chemical Biology,,27064299.0,,1844-51,117.0,,0.0,,,0.0,0.0,,11,2016.0,,,,,0,0,0,0,0,0,0
"Deep learning is rapidly advancing many areas of science and technology with multiple success stories in image, text, voice and video recognition, robotics, and autonomous driving. In this paper we demonstrate how deep neural networks (DNN) trained on large transcriptional response data sets can classify various drugs to therapeutic categories solely based on their transcriptional profiles. We used the perturbation samples of 678 drugs across A549, MCF-7, and PC-3 cell lines from the LINCS Project and linked those to 12 therapeutic use categories derived from MeSH. To train the DNN, we utilized both gene level transcriptomic data and transcriptomic data processed using a pathway activation scoring algorithm, for a pooled data set of samples perturbed with different concentrations of the drug for 6 and 24 hours. In both pathway and gene level classification, DNN achieved high classification accuracy and convincingly outperformed the support vector machine (SVM) model on every multiclass classification problem, however, models based on pathway level data performed significantly better. For the first time we demonstrate a deep learning neural net trained on transcriptomic data to recognize pharmacological properties of multiple drugs across different biological systems and conditions. We also propose using deep neural net confusion matrices for drug repositioning. This work is a proof of principle for applying deep learning to drug discovery and development.",1.0,Deep learning applications for predicting pharmacological properties of drugs and drug repurposing using transcriptomic data.,0.0,"Aliper A, Plis S, Artemov A, Ulloa A, Mamoshina P, Zhavoronkov A",,0.0,,8/30/16 15:51,1.0,0.0,1.0,0.0,10.1021 acs.molpharmaceut.6b00248,7,Molecular Pharmaceutics,,27200455.0,PMC496526,2524-30,78.0,,0.0,,,0.0,0.0,,13,2016.0,PMC4965264,"['5116087', '5938574', '5355231', '6059760', '5042864', '5996063', '5814166', '5723685', '6027196', '5641581', '5489441', '5865701', '5828388', '5193106', '6034501', '6022084', '5561257', '5076455']",18.0,"[2016, 2018, 2016, 2018, 2016, 2018, 2017, 2017, 2018, 2017, 2017, 2018, 2018, 2016, 2017, 2018, 2017, 2016]",0,0,0,0,0,0,0
"The NIH-funded LINCS program has been initiated to generate a library of integrated, network-based, cellular signatures (LINCS). A novel high-throughput gene-expression profiling assay known as L1000 was the main technology used to generate more than a million transcriptional profiles. The profiles are based on the treatment of 14 cell lines with one of many perturbation agents of interest at a single concentration for 6 and 24 hours duration. In this study, we focus on the chemical compound treatments within the LINCS data set. The experimental variables available include number of replicates, cell lines, and time points. Our study reveals that compound characterization based on three cell lines at two time points results in more genes being affected than six cell lines at a single time point. Based on the available LINCS data, we conclude that the most optimal experimental design to characterize a large set of compounds is to test them in duplicate in three different cell lines. Our conclusions are constrained by the fact that the compounds were profiled at a single, relative high concentration, and the longer time point is likely to result in phenotypic rather than mechanistic effects being recorded.",0.0,Transcriptional characterization of compounds: Lessons learned from the public LINCS data.,0.0,"De Wolf H, De Bondt A, Turner H, Göhlmann HW",,0.0,,8/30/16 15:51,1.0,0.0,0.0,0.0,10.1089/adt.2016.715,4,Assay and Drug Development Technologies,,27187605.0,PMC487650,252-60,79.0,,0.0,,,0.0,0.0,,14,2016.0,PMC4876500,"['5763468', '5124246', '5192966']",3.0,"[2017, 2016, 2016]",0,0,0,0,0,0,0
"Background: Gene expression connectivity mapping has proven to be a powerful and flexible tool for research. Its application has been shown in a broad range of research topics, most commonly as a means of identifying potential small molecule compounds, which may be further investigated as candidates for repurposing to treat diseases. The public release of voluminous data from the Library of Integrated Cellular Signatures (LINCS) programme further enhanced the utilities and potentials of gene expression connectivity mapping in biomedicine. Results: We describe QUADrATiC (http://go.qub.ac.uk/QUADrATiC), a user-friendly tool for the exploration of gene expression connectivity on the subset of the LINCS data set corresponding to FDA-approved small molecule compounds. It enables the identification of compounds for repurposing therapeutic potentials. The software is designed to cope with the increased volume of data over existing tools, by taking advantage of multicore computing architectures to provide a scalable solution, which may be installed and operated on a range of computers, from laptops to servers. This scalability is provided by the use of the modern concurrent programming paradigm provided by the Akka framework. The QUADrATiC Graphical User Interface (GUI) has been developed using advanced Javascript frameworks, providing novel visualization capabilities for further analysis of connections. There is also a web services interface, allowing integration with other programs or scripts. Conclusions: QUADrATiC has been shown to provide an improvement over existing connectivity map software, in terms of scope (based on the LINCS data set), applicability (using FDA-approved compounds), usability and speed. It offers potential to biological researchers to analyze transcriptional data and generate potential therapeutics for focussed study in the lab. QUADrATiC represents a step change in the process of investigating gene expression connectivity and provides more biologically-relevant results than previous alternative solutions.",1.0,QUADrATiC: scalable gene expression connectivity mapping for repurposing FDA-approved therapeutics.,0.0,"O'Reilly PG, Wen Q, Bankhead P, Dunne PD, McArt DG, McPherson S, Hamilton PW, Mills KI, Zhang SD",,0.0,,8/30/16 15:51,1.0,0.0,1.0,0.0,doi: 10.1186/s12859-016-1062-1,1,BMC Bioinformatics,,27143038.0,PMC485547,198,81.0,,0.0,,,0.0,1.0,,17,2016.0,PMC4855472,"['5356876', '5952941', '5738174', '5740937']",4.0,"[2016, 2017, 2017, 2017]",0,0,0,1,0,0,0
"Ozone is a common, potent oxidant pollutant in industrialized nations. Ozone exposure causes airway hyperreactivity, lung hyperpermeability, inflammation, and cell damage in humans and laboratory animals, and exposure to ozone has been associated with exacerbation of asthma, altered lung function, and mortality. The mechanisms of ozone-induced lung injury and differential susceptibility are not fully understood. Ozone-induced lung inflammation is mediated, in part, by the innate immune system. We hypothesized that mannose-binding lectin (MBL), an innate immunity serum protein, contributes to the proinflammatory events caused by ozone-mediated activation of the innate immune system. Wild-type (Mbl(+/+)) and MBL-deficient (Mbl(-/-)) mice were exposed to ozone (0.3 ppm) for up to 72 h, and bronchoalveolar lavage fluid was examined for inflammatory markers. Mean numbers of eosinophils and neutrophils and levels of the neutrophil attractants C-X-C motif chemokines 2 [Cxcl2 (major intrinsic protein 2)] and 5 [Cxcl5 (limb expression, LIX)] in the bronchoalveolar lavage fluid were significantly lower in Mbl(-/-) than Mbl(+/+) mice exposed to ozone. Using genome-wide mRNA microarray analyses, we identified significant differences in transcript response profiles and networks at baseline [e.g., nuclear factor erythroid-related factor 2 (NRF2)-mediated oxidative stress response] and after exposure (e.g., humoral immune response) between Mbl(+/+) and Mbl(-/-) mice. The microarray data were further analyzed to discover several informative differential response patterns and subsequent gene sets, including the antimicrobial response and the inflammatory response. We also used the lists of gene transcripts to search the LINCS L1000CDS(2) data sets to identify agents that are predicted to perturb ozone-induced changes in gene transcripts and inflammation. These novel findings demonstrate that targeted deletion of Mbl caused differential levels of inflammation-related gene sets at baseline and after exposure to ozone and significantly reduced pulmonary inflammation, thus indicating an important innate immunomodulatory role of the gene in this model.",0.0,Effects of mannose-binding lectin on pulmonary gene expression and innate immune inflammatory response to ozone.,0.0,"Ciencewicki JM, Verhein KC, Gerrish K, McCaw ZR, Li J, Bushel PR, Kleeberger SR",,0.0,,8/30/16 15:51,1.0,0.0,1.0,0.0,10.1152/ajplung.00205.2015,2,American Journal of Physiology - Lung Cellular and Molecular Physiology,,27106289.0,,L280-91,82.0,,0.0,,,0.0,0.0,,311,2016.0,PMC5005272,"['5486273', '5596881']",2.0,"[2017, 2016]",0,0,0,0,0,0,0
"Polypharmacology (the ability of a drug to affect more than one molecular target) is considered a basic property of many therapeutic small molecules. Herein, we used a chemical genomics approach to systematically analyze polypharmacology by integrating several analytical tools, including the LINCS (Library of Integrated Cellular Signatures), STITCH (Search Tool for Interactions of Chemicals), and WebGestalt (WEB-based GEne SeT AnaLysis Toolkit). We applied this approach to identify functional disparities between two cytidine nucleoside analogs: azacytidine (AZA) and decitabine (DAC). AZA and DAC are structurally and mechanistically similar DNA-hypomethylating agents. However, their metabolism and destinations in cells are distinct. Due to their differential incorporation into RNA or DNA, functional disparities between AZA and DAC are expected. Indeed, different cytotoxicities of AZA and DAC toward human colorectal cancer cell lines were observed, in which cells were more sensitive to AZA. Based on a polypharmacological analysis, we found that AZA transiently blocked protein synthesis and induced an acute apoptotic response that was antagonized by concurrently induced cytoprotective autophagy. In contrast, DAC caused cell cycle arrest at the G2/M phase associated with p53 induction. Therefore, our study discriminated functional disparities between AZA and DAC, and also demonstrated the value of this chemical genomics approach that can be applied to discover novel drug action mechanisms.",0.0,Systematic discovery of drug action mechanisms by an integrated chemical genomics approach: identification of functional disparities between azacytidine and decitabine.,0.0,"Hsieh YY, Huang TC, Lo HL, Jhan JY, Chen ST, Yang PM",,0.0,,8/30/16 15:51,1.0,0.0,1.0,0.0,10.18632/oncotarget.8455,19,Oncotarget,,27036028.0,,27363-78,83.0,,0.0,,,0.0,0.0,,7,2016.0,PMC5053656,[],0.0,,0,0,0,0,0,0,0
