abstract,analytical_method_development,article_name,assay_development,authors,center,center_pub,comments,created_at,data_analysis,data_generation,data_integration,data_standards,doi,issue,journal_name,other_link,pm_id,pmc_id,pp_pages,publication_id,resource_links,review,scopus_citations,show_at_home_order,signature_generation,software_development,updated_at,volume,year_published,PMCID,citations,n_citations,citation_years,DCIC,Drug Toxicity,Proteomics,Microenvironment,HMS,Transcriptomics,NeuroLINCS
"The Library of Integrated Network-based Cellular Signatures (LINCS) project is a large-scale coordinated effort to build a comprehensive systems biology reference resource. The goals of the program include the generation of a very large multidimensional data matrix and informatics and computational tools to integrate, analyze, and make the data readily accessible. LINCS data include genome-wide transcriptional signatures, biochemical protein binding profiles, cellular phenotypic response profiles and various other datasets for a wide range of cell model systems and molecular and genetic perturbations. Here we present a partial survey of this data facilitated by data standards and in particular a robust compound standardization workflow; we integrated several types of LINCS signatures and analyzed the results with a focus on mechanism of action (MoA) and chemical compounds. We illustrate how kinase targets can be related to disease models and relevant drugs. We identified some fundamental trends that appear to link Kinome binding profiles and transcriptional signatures to chemical information and biochemical binding profiles to transcriptional responses independent of chemical similarity. To fill gaps in the datasets we developed and applied predictive models. The results can be interpreted at the systems level as demonstrated based on a large number of signaling pathways. We can identify clear global relationships, suggesting robustness of cellular responses to chemical perturbation. Overall, the results suggest that chemical similarity is a useful measure at the systems level, which would support phenotypic drug optimization efforts. With this study we demonstrate the potential of such integrated analysis approaches and suggest prioritizing further experiments to fill the gaps in the current data.",0.0,"Large-scale integration of small molecule-induced genome-wide transcriptional responses, Kinome-wide binding affinities and cell-growth inhibition profiles reveal global trends characterizing systems-level drug action.",0.0,"Vidović D, Koleti A, Schürer SC",,1.0,,5/19/16 18:33,1.0,0.0,1.0,0.0,10.3389/fgene.2014.00342,,Frontiers in Genetics,,25324859.0,PMC4179751,342,10.0,"{\LIFE\"":\""http://life.ccs.miami.edu/life/\""}""",0.0,,,0.0,1.0,5/19/16 18:33,5,2014.0,PMC4179751,"['4652136', '5938574', '5860178', '5447464', '4719067', '4625862', '5952941', '4783079', '4657038', '5864870', '4967295', '5984374', '5510182', '5193106', '5663545', '5001780', '5679337', '5758385', '5737394']",19.0,"[2015, 2018, 2016, 2017, 2015, 2015, 2017, 2016, 2015, 2018, 2016, 2018, 2017, 2016, 2017, 2016, 2017, 2017, 2017]",0,0,0,0,0,0,0
"Panorama is a web application for storing, sharing, analyzing, and reusing targeted assays created and refined with Skyline,1 an increasingly popular Windows client software tool for targeted proteomics experiments. Panorama allows laboratories to store and organize curated results contained in Skyline documents with fine-grained permissions, which facilitates distributed collaboration and secure sharing of published and unpublished data via a web-browser interface. It is fully integrated with the Skyline workflow and supports publishing a document directly to a Panorama server from the Skyline user interface. Panorama captures the complete Skyline document information content in a relational database schema. Curated results published to Panorama can be aggregated and exported as chromatogram libraries. These libraries can be used in Skyline to pick optimal targets in new experiments and to validate peak identification of target peptides. Panorama is open-source and freely available. It is distributed as part of LabKey Server,2 an open source biomedical research data management system. Laboratories and organizations can set up Panorama locally by downloading and installing the software on their own servers. They can also request freely hosted projects on https://panoramaweb.org , a Panorama server maintained by the Department of Genome Sciences at the University of Washington.",0.0,Panorama: a targeted proteomics knowledge base.,0.0,"Jaffe JD, Carr SA, Sharma V, Eckels J, Taylor GK, Shulman NJ, Stergachis AB, Joyner SA, Yan P, Whiteaker JR, Halusa GN, Schilling B, Gibson BW, Colangelo CM, Paulovich AG, MacCoss MJ, MacLean B",,1.0,,5/19/16 18:33,1.0,0.0,1.0,0.0,10.1021/pr5006636,9,Journal of Proteome Research,,25102069.0,PMC4156235,4205-10,11.0,"{\Panorama\"":\""https://panoramaweb.org/\""}""",0.0,,,0.0,1.0,5/19/16 18:33,13,2014.0,PMC4156235,"['5570441', '4937520', '4304520', '5616215', '6088389', '5671767', '6089676', '5460347', '5358945', '5016147', '5380061', '4597152', '5172568', '5729929', '4738454', '5017244', '4676880', '5340999', '6026592', '5220582', '5490909', '4715485', '4419343', '4411476', '5294213', '4830481', '5986241', '5083090', '5393399', '5117667', '4893672', '5406750', '5799026', '5799042', '5951639', '5487020', '6049031', '4858938', '5245710', '6021760', '5939939', '5436697', '4890179', '5677521', '5778013', '5500765']",46.0,"[0, 2016, 2014, 0, 2018, 0, 2018, 2017, 2017, 2016, 2017, 2015, 2016, 0, 2015, 0, 2015, 2016, 2018, 0, 2017, 2015, 0, 2015, 2016, 0, 2018, 2016, 2017, 2016, 2016, 2016, 2017, 2017, 2018, 2017, 2018, 2016, 2016, 2017, 2018, 2017, 2016, 2015, 2018, 2017]",0,0,1,0,0,0,0
"Data sets from recent large-scale projects can be integrated into one unified puzzle that can provide new insights into how drugs and genetic perturbations applied to human cells are linked to whole-organism phenotypes. Data that report how drugs affect the phenotype of human cell lines and how drugs induce changes in gene and protein expression in human cell lines can be combined with knowledge about human disease, side effects induced by drugs, and mouse phenotypes. Such data integration efforts can be achieved through the conversion of data from the various resources into single-node-type networks, gene-set libraries, or multipartite graphs. This approach can lead us to the identification of more relationships between genes, drugs, and phenotypes as well as benchmark computational and experimental methods. Overall, this lean 'Big Data' integration strategy will bring us closer toward the goal of realizing personalized medicine.",0.0,Lean Big Data integration in systems biology and systems pharmacology.,0.0,"Wang Z, Ma'ayan A, Kou Y, Rouillard AD, Duan Q, Clark NR",,1.0,,5/19/16 18:33,0.0,0.0,1.0,0.0,10.1016/j.tips.2014.07.001,9,Trends in Pharmacological Sciences,,25109570.0,PMC4153537,450-60,12.0,"{\Review of multiple tools and databases\"":null}""",1.0,,,0.0,0.0,5/19/16 18:33,35,2014.0,PMC4153537,"['4557916', '6043797', '4833304', '5407990', '5626567', '5053656', '4691095', '5001780', '5350134', '5461547', '5689675', '4979501', '4804633', '5893633', '4274604', '5753343', '4592529', '4625862', '5716118', '4930834', '5636275']",21.0,"[2015, 2018, 2016, 2017, 2016, 2016, 2015, 2016, 2017, 2017, 2017, 2016, 2016, 2018, 0, 2017, 2015, 2015, 0, 2016, 2017]",1,0,0,0,0,0,0
"Bioinformatics and computer aided drug design rely on the curation of a large number of protocols for biological assays that measure the ability of potential drugs to achieve a therapeutic effect. These assay protocols are generally published by scientists in the form of plain text, which needs to be more precisely annotated in order to be useful to software methods. We have developed a pragmatic approach to describing assays according to the semantic definitions of the BioAssay Ontology (BAO) project, using a hybrid of machine learning based on natural language processing, and a simplified user interface designed to help scientists curate their data with minimum effort. We have carried out this work based on the premise that pure machine learning is insufficiently accurate, and that expecting scientists to find the time to annotate their protocols manually is unrealistic. By combining these approaches, we have created an effective prototype for which annotation of bioassay text within the domain of the training set can be accomplished very quickly. Well-trained annotations require single-click user approval, while annotations from outside the training set domain can be identified using the search feature of a well-designed user interface, and subsequently used to improve the underlying models. By drastically reducing the time required for scientists to annotate their assays, we can realistically advocate for semantic annotation to become a standard part of the publication process. Once even a small proportion of the public body of bioassay data is marked up, bioinformatics researchers can begin to construct sophisticated and useful searching and analysis algorithms that will provide a diverse and powerful set of tools for drug discovery researchers.",0.0,Fast and accurate semantic annotation of bioassays exploiting a hybrid of machine learning and user confirmation.,0.0,"Schürer SC, Clark AM, Bunin BA, Litterman NK, Visser U",,1.0,,5/19/16 18:33,0.0,0.0,0.0,1.0,10.7717/peerj.524,,PeerJ,,25165633.0,PMC4137659,e524,13.0,"{\LIFE\"":\""http://life.ccs.miami.edu/life/\""}""",0.0,,,0.0,0.0,5/19/16 18:33,2,2014.0,PMC4137659,"['4369291', '4510462', '4360371', '6070956']",4.0,"[2015, 2015, 2014, 2018]",0,0,0,0,0,0,0
"For the Library of Integrated Network-based Cellular Signatures (LINCS) project many gene expression signatures using the L1000 technology have been produced. The L1000 technology is a cost-effective method to profile gene expression in large scale. LINCS Canvas Browser (LCB) is an interactive HTML5 web-based software application that facilitates querying, browsing and interrogating many of the currently available LINCS L1000 data. LCB implements two compacted layered canvases, one to visualize clustered L1000 expression data, and the other to display enrichment analysis results using 30 different gene set libraries. Clicking on an experimental condition highlights gene-sets enriched for the differentially expressed genes from the selected experiment. A search interface allows users to input gene lists and query them against over 100 000 conditions to find the top matching experiments. The tool integrates many resources for an unprecedented potential for new discoveries in systems biology and systems pharmacology. The LCB application is available at http://www.maayanlab.net/LINCS/LCB. Customized versions will be made part of the http://lincscloud.org and http://lincs.hms.harvard.edu websites.",1.0,"LINCS Canvas Browser: interactive web app to query, browse and interrogate LINCS L1000 gene expression signatures.",0.0,"Ma'ayan A, Rouillard AD, Niepel M, Sorger PK, Duan Q, Fernandez NF, Tan CM, Subramanian A, Flynn C, Hafner M, Muhlich JL, Chen EY, Golub TR",,1.0,,5/19/16 18:33,1.0,0.0,1.0,0.0,10.1093/nar/gku476,,Nucleic Acids Research,,24906883.0,PMC4086130,W449-60,14.0,"{\LINCS Canvas Browser\"":\""http://www.maayanlab.net/LINCS/LCB\""}""",0.0,,,0.0,1.0,5/19/16 18:33,42,2014.0,PMC4086130,"['5662764', '5726792', '5952941', '5300121', '4834551', '5819766', '5693369', '4917453', '4583778', '5159871', '5192966', '5737394', '5962550', '4919895', '4333019', '5503518', '5053656', '6044382', '5882888', '4976700', '5001780', '5355998', '5596881', '5974511', '4845762', '4673434', '4374785', '5838628', '5482631', '4382730', '6020840', '5653784', '4675694', '5635550', '5641581', '5046221', '6063738', '5760621', '5025164', '5672545', '5638208', '5005272', '5799026', '5029662', '4153537', '5860760', '4945830', '5810031', '5753597', '5287226', '5223214', '5181570', '4689484', '4518198', '5215403', '5734428', '4930834', '5502825', '5102256', '4600621', '4858944', '5921396', '5532784']",63.0,"[2017, 2017, 2017, 2017, 2016, 2018, 2017, 2016, 2015, 2016, 2016, 2017, 2018, 2016, 2015, 2017, 2016, 2018, 2018, 2016, 2016, 2017, 2016, 2018, 2016, 2015, 2015, 2018, 2017, 0, 2017, 2017, 0, 2017, 2017, 2016, 2018, 2018, 2016, 2017, 2017, 2016, 2017, 2016, 2014, 2018, 2015, 2018, 0, 0, 2017, 2016, 2015, 2015, 2016, 2017, 2016, 2017, 2016, 2015, 2016, 2018, 2017]",1,0,1,0,1,1,0
"The lack of established standards to describe and annotate biological assays and screening outcomes in the domain of drug and chemical probe discovery is a severe limitation to utilize public and proprietary drug screening data to their maximum potential. We have created the BioAssay Ontology (BAO) project (http://bioassayontology.org) to develop common reference metadata terms and definitions required for describing relevant information of low-and high-throughput drug and probe screening assays and results. The main objectives of BAO are to enable effective integration, aggregation, retrieval, and analyses of drug screening data. Since we first released BAO on the BioPortal in 2010 we have considerably expanded and enhanced BAO and we have applied the ontology in several internal and external collaborative projects, for example the BioAssay Research Database (BARD). We describe the evolution of BAO with a design that enables modeling complex assays including profile and panel assays such as those in the Library of Integrated Network-based Cellular Signatures (LINCS). One of the critical questions in evolving BAO is the following: how can we provide a way to efficiently reuse and share among various research projects specific parts of our ontologies without violating the integrity of the ontology and without creating redundancies. This paper provides a comprehensive answer to this question with a description of a methodology for ontology modularization using a layered architecture. Our modularization approach defines several distinct BAO components and separates internal from external modules and domain-level from structural components. This approach facilitates the generation/extraction of derived ontologies (or perspectives) that can suit particular use cases or software applications. We describe the evolution of BAO related to its formal structures, engineering approaches, and content to enable modeling of complex assays and integration with other ontologies and datasets.",0.0,"Evolving BioAssay Ontology (BAO): modularization, integration and applications.",0.0,"Koleti A, Schürer SC, Visser U, Abeyruwan S, Vempati UD, Küçük-McGinty H, Mir A, Sakurai K, Chung C, Bittker JA, Clemons PA, Brudz S, Siripala A, Morales AJ, Romacker M, Twomey D, Bureeva S, Lemmon V",,1.0,,5/19/16 18:33,0.0,0.0,0.0,1.0,10.1186/2041-1480-5-S1-S5,Suppl 1 Proceedings of the Bio-Ontologies Spec Interest G,Journal of Biomedical Semantics,,25093074.0,PMC4108877,S5,15.0,"{\LIFE\"":\""http://life.ccs.miami.edu/life/\""}""",0.0,,,0.0,0.0,5/19/16 18:33,5,2014.0,PMC4108877,"['6007090', '4137659', '4607714', '5679337', '5129546', '5814751', '4823819', '4108850', '5487293', '4578352', '4652617', '5622518', '4943296', '4510462', '6004408', '5753343', '4556094', '5210557', '5683383', '5763302', '5753190', '5978404', '5765662']",23.0,"[2018, 2014, 2015, 2017, 2016, 0, 2016, 2014, 2017, 2015, 2015, 2017, 2016, 2015, 2018, 2017, 0, 2016, 2017, 2017, 2017, 2018, 2018]",0,0,0,0,0,0,0
,0.0,Red blood cells tracking using optical flow methods.,1.0,"Guo D, van de Ven AL, Zhou X",,1.0,,5/19/16 18:33,0.0,0.0,0.0,0.0,10.1109/JBHI.2013.2281915,3,IEEE Journal of Biomedical and Health Informatics,,24058034.0,PMC3990667,991-8,16.0,"{\CellIA\"":null}""",0.0,,,0.0,0.0,5/19/16 18:33,18,2014.0,PMC3990667,"['4256590', '5554580', '5134501']",3.0,"[2014, 2017, 2016]",0,0,0,0,0,0,0
"BACKGROUND: Soluble growth factors present in the microenvironment play a major role in tumor development, invasion, metastasis, and responsiveness to targeted therapies. While the biochemistry of growth factor-dependent signal transduction has been studied extensively in individual cell types, relatively little systematic data are available across genetically diverse cell lines. RESULTS: We describe a quantitative and comparative dataset focused on immediate-early signaling that regulates the AKT (AKT1/2/3) and ERK (MAPK1/3) pathways in a canonical panel of well-characterized breast cancer lines. We also provide interactive web-based tools to facilitate follow-on analysis of the data. Our findings show that breast cancers are diverse with respect to ligand sensitivity and signaling biochemistry. Surprisingly, triple negative breast cancers (TNBCs; which express low levels of ErbB2, progesterone and estrogen receptors) are the most broadly responsive to growth factors and HER2amp cancers (which overexpress ErbB2) the least. The ratio of ERK to AKT activation varies with ligand and subtype, with a systematic bias in favor of ERK in hormone receptor positive (HR+) cells. The factors that correlate with growth factor responsiveness depend on whether fold-change or absolute activity is considered the key biological variable, and they differ between ERK and AKT pathways. CONCLUSIONS: Responses to growth factors are highly diverse across breast cancer cell lines, even within the same subtype. A simple four-part heuristic suggests that diversity arises from variation in receptor abundance, an ERK/AKT bias that depends on ligand identity, a set of factors common to all receptors that varies in abundance or activity with cell line, and an \indirect negative regulation\"" by ErbB2. This analysis sets the stage for the development of a mechanistic and predictive model of growth factor signaling in diverse cancer lines. Interactive tools for looking up these results and downloading raw data are available at http://lincs.hms.harvard.edu/niepel-bmcbiol-2014/.""",0.0,Analysis of growth factor signaling in genetically diverse breast cancer lines.,0.0,"Niepel M, Sorger PK, Hafner M, Muhlich JL, Pace EA, Chung M, Chai DH, Zhou L, Schoeberl B",,1.0,,5/19/16 18:33,1.0,1.0,1.0,0.0,10.1186/1741-7007-12-20,,BMC Biology,,24655548.0,PMC4234128,20,17.0,"{\Publication Summary\"":\""http://lincs.hms.harvard.edu/niepel-bmcbiol-2014/\"", \""Project Explorer\"":\""http://lincs.hms.harvard.edu/explore/breast-cancer-signaling/\""}""",0.0,,,1.0,0.0,5/19/16 18:33,12,2014.0,PMC4234128,"['5516865', '5001206', '5293153', '5224466', '5662764', '4355234', '4314810', '5978689', '4628897', '5401947', '4567444', '4775099', '5886578', '4490239', '5746471', '5536966']",16.0,"[2017, 2016, 2017, 2016, 2017, 2015, 2015, 2018, 2015, 2017, 2015, 2015, 2018, 2015, 2017, 2014]",0,0,0,0,1,0,0
"The National Institutes of Health Library of Integrated Network-based Cellular Signatures (LINCS) program is generating extensive multidimensional data sets, including biochemical, genome-wide transcriptional, and phenotypic cellular response signatures to a variety of small-molecule and genetic perturbations with the goal of creating a sustainable, widely applicable, and readily accessible systems biology knowledge resource. Integration and analysis of diverse LINCS data sets depend on the availability of sufficient metadata to describe the assays and screening results and on their syntactic, structural, and semantic consistency. Here we report metadata specifications for the most important molecular and cellular components and recommend them for adoption beyond the LINCS project. We focus on the minimum required information to model LINCS assays and results based on a number of use cases, and we recommend controlled terminologies and ontologies to annotate assays with syntactic consistency and semantic integrity. We also report specifications for a simple annotation format (SAF) to describe assays and screening results based on our metadata specifications with explicit controlled vocabularies. SAF specifically serves to programmatically access and exchange LINCS data as a prerequisite for a distributed information management infrastructure. We applied the metadata specifications to annotate large numbers of LINCS cell lines, proteins, and small molecules. The resources generated and presented here are freely available.",0.0,"Metadata standard and data exchange specifications to describe, model, and integrate complex and diverse high-throughput screening data from the Library of Integrated Network-based Cellular Signatures (LINCS).",0.0,"Benes CH, Subramanian A, Vidović D, Koleti A, Schürer SC, Muhlich JL, Vempati UD, Chung C, Mader C, Datar N, Wrobel D, Erickson S, Berriz G, Pillai A, Shamu CE",,1.0,,5/19/16 18:33,0.0,0.0,0.0,1.0,10.1177/1087057114522514,5,Journal of Biomolecular Screening,,24518066.0,,803-816,18.0,"{\LIFE\"":\""http://life.ccs.miami.edu/life/\"",\""Data Standards\"":\""http://amp.pharm.mssm.edu/LINCS/data/standards\""}""",0.0,,,0.0,1.0,5/19/16 18:33,19,2014.0,,,,,0,0,1,0,0,0,0
"High-content screening (HCS; fluorescence microscopy with multiple markers followed by automated image analysis) is gaining popularity in drug discovery due to the rich information it reveals about drug responses. It is particularly useful in studying anti-mitotic drug responses since mitotic arrest provides an activity biomarker. One conventional way to probe mitotic arrest and downstream apoptosis response is to use mitosis- and apoptosis-specific antibodies in cell-based imaging assays. However, weakly attached cells, especially dead cells, are mostly washed out during antibody labeling steps. Here, we report a rapid and convenient one-step cell-imaging assay that accurately measures cell-cycle state and apoptosis in mammalian cells. The assay uses three fluorescent dyes to stain living cells, involves no wash, and is fixable after live-cell labeling. Compared to the antibody-based method, this assay is quicker, more cost-effective, and yields more accurate dose-response results.",0.0,A one-step imaging assay to monitor cell cycle state and apoptosis in mammalian cells.,1.0,Tang Y,,1.0,,6/22/16 0:00,0.0,0.0,0.0,0.0,10.1002/9780470559277.ch130140,1,Current Protocols in Chemical Biology,,24652619.0,PMC4016950,5-Jan,65.0,,0.0,,,0.0,0.0,,6,2014.0,PMC4016950,[],0.0,,0,0,0,0,0,0,0
"BACKGROUND: Thousands of biological and biomedical investigators study of the functional role of single genes and their protein products in normal physiology and in disease. The findings from these studies are reported in research articles that stimulate new research. It is now established that a complex regulatory networks's is controlling human cellular fate, and this community of researchers are continually unraveling this network topology. Attempts to integrate results from such accumulated knowledge resulted in literature-based protein-protein interaction networks (PPINs) and pathway databases. These databases are widely used by the community to analyze new data collected from emerging genome-wide studies with the assumption that the data within these literature-based databases is the ground truth and contain no biases. While suspicion for research focus biases is growing, a concrete proof for it is still missing. It is difficult to prove because the real PPINs are mostly unknown. RESULTS: Here we analyzed the longitudinal discovery process of literature-based mammalian and yeast PPINs to observe that these networks are discovered non-uniformly. The pattern of discovery is related to a theoretical concept proposed by Kauffman called \expanding the adjacent possible\"". We introduce a network discovery model which explicitly includes the space of possibilities in the form of a true underlying PPIN. CONCLUSIONS: Our model strongly suggests that research focus biases exist in the observed discovery dynamics of these networks. In summary, more care should be placed when using PPIN databases for analysis of newly acquired data, and when considering prior knowledge when designing new experiments.""",1.0,Dynamics of the discovery process of protein-protein interactions from low content studies.,0.0,"Wang Z, Ma'ayan A, Clark NC",,1.0,,5/19/16 18:33,1.0,0.0,1.0,0.0,10.1186/s12918-015-0173-z,1,BMC Systems Biology,,26048415.0,PMC4456804,26,1.0,"{\Custom code\"":null}""",0.0,,,0.0,1.0,5/19/16 18:33,9,2015.0,PMC4456804,"['5389891', '4930834', '4704491', '5052684', '5636275', '6030863']",6.0,"[2016, 2016, 2015, 2016, 2017, 2018]",1,0,0,0,0,0,0
,,Dynamics of the discovery process of protein-protein interactions from low content studies.,,"Wang Z,Clark NR,Ma'ayan A",DCIC,1.0,funded in part by LINCS,,,,,,,,,,26048415.0,,,214.0,,,5.0,,,,,,2015.0,PMC4456804,"['5389891', '4930834', '4704491', '5052684', '5636275', '6030863']",6.0,"[2016, 2016, 2015, 2016, 2017, 2018]",1,0,0,0,0,0,0
